[INFO]    Initializing ODM 3.5.6 - Wed Jan 07 05:47:03  2026
[INFO]    ==============
[INFO]    3d_tiles: False
[INFO]    align: None
[INFO]    auto_boundary: False
[INFO]    auto_boundary_distance: 0
[INFO]    bg_removal: False
[INFO]    boundary: {}
[INFO]    build_overviews: False
[INFO]    camera_lens: auto
[INFO]    cameras: {}
[INFO]    cog: True
[INFO]    copy_to: None
[INFO]    crop: 3
[INFO]    dem_decimation: 1
[INFO]    dem_euclidean_map: False
[INFO]    dem_gapfill_steps: 3
[INFO]    dem_resolution: 5
[INFO]    dsm: False
[INFO]    dtm: False
[INFO]    end_with: odm_postprocess
[INFO]    fast_orthophoto: False
[INFO]    feature_quality: high
[INFO]    feature_type: dspsift
[INFO]    force_gps: False
[INFO]    gcp: None
[INFO]    geo: None
[INFO]    gltf: True
[INFO]    gps_accuracy: 3
[INFO]    gps_z_offset: 0
[INFO]    ignore_gsd: False
[INFO]    matcher_neighbors: 0
[INFO]    matcher_order: 0
[INFO]    matcher_type: flann
[INFO]    max_concurrency: 11
[INFO]    merge: all
[INFO]    merge_skip_blending: False
[INFO]    mesh_octree_depth: 11
[INFO]    mesh_size: 200000
[INFO]    min_num_features: 10000
[INFO]    name: bd853eb0-fc89-4fbe-933a-77edcf965e08
[INFO]    no_gpu: False
[INFO]    optimize_disk_space: False
[INFO]    orthophoto_compression: DEFLATE
[INFO]    orthophoto_cutline: False
[INFO]    orthophoto_kmz: False
[INFO]    orthophoto_no_tiled: False
[INFO]    orthophoto_png: False
[INFO]    orthophoto_resolution: 5
[INFO]    pc_classify: False
[INFO]    pc_copc: False
[INFO]    pc_csv: False
[INFO]    pc_ept: True
[INFO]    pc_filter: 5
[INFO]    pc_las: False
[INFO]    pc_quality: medium
[INFO]    pc_rectify: False
[INFO]    pc_sample: 0
[INFO]    pc_skip_geometric: False
[INFO]    primary_band: auto
[INFO]    project_path: /var/www/data/bd853eb0-fc89-4fbe-933a-77edcf965e08
[INFO]    radiometric_calibration: none
[INFO]    rerun: None
[INFO]    rerun_all: False
[INFO]    rerun_from: None
[INFO]    rolling_shutter: False
[INFO]    rolling_shutter_readout: 0
[INFO]    sfm_algorithm: incremental
[INFO]    sfm_no_partial: False
[INFO]    skip_3dmodel: False
[INFO]    skip_band_alignment: False
[INFO]    skip_orthophoto: False
[INFO]    skip_report: False
[INFO]    sky_removal: False
[INFO]    sm_cluster: None
[INFO]    sm_no_align: False
[INFO]    smrf_scalar: 1.25
[INFO]    smrf_slope: 0.15
[INFO]    smrf_threshold: 0.5
[INFO]    smrf_window: 18.0
[INFO]    split: 999999
[INFO]    split_image_groups: None
[INFO]    split_overlap: 150
[INFO]    texturing_keep_unseen_faces: False
[INFO]    texturing_single_material: False
[INFO]    texturing_skip_global_seam_leveling: False
[INFO]    tiles: False
[INFO]    use_3dmesh: False
[INFO]    use_exif: False
[INFO]    use_fixed_camera_params: False
[INFO]    use_hybrid_bundle_adjustment: False
[INFO]    video_limit: 500
[INFO]    video_resolution: 4000
[INFO]    ==============
[INFO]    Running dataset stage
[INFO]    Loading dataset from: /var/www/data/bd853eb0-fc89-4fbe-933a-77edcf965e08/images
[INFO]    Loading 17 images
[INFO]    Wrote images database: /var/www/data/bd853eb0-fc89-4fbe-933a-77edcf965e08/images.json
[INFO]    Found 17 usable images
[WARNING] GPS position not available for image_4.jpg
[WARNING] GPS position not available for image_2.jpg
[WARNING] GPS position not available for image_9.jpg
[WARNING] GPS position not available for image_5.jpg
[WARNING] GPS position not available for image_17.jpg
[WARNING] GPS position not available for image_1.jpg
[WARNING] GPS position not available for image_10.jpg
[WARNING] GPS position not available for image_14.jpg
[WARNING] GPS position not available for image_13.jpg
[WARNING] GPS position not available for image_12.jpg
[WARNING] GPS position not available for image_15.jpg
[WARNING] GPS position not available for image_6.jpg
[WARNING] GPS position not available for image_7.jpg
[WARNING] GPS position not available for image_3.jpg
[WARNING] GPS position not available for image_11.jpg
[WARNING] GPS position not available for image_16.jpg
[WARNING] GPS position not available for image_8.jpg
[WARNING] Could not generate coordinates file. The orthophoto will not be georeferenced.
[INFO]    Finished dataset stage
[INFO]    Running split stage
[INFO]    Normal dataset, will process all at once.
[INFO]    Finished split stage
[INFO]    Running merge stage
[INFO]    Normal dataset, nothing to merge.
[INFO]    Finished merge stage
[INFO]    Running opensfm stage
[INFO]    Maximum photo dimensions: 1440px
[INFO]    Photo dimensions for feature extraction: 1440px
[INFO]    No GPS information, using BOW matching by default (you can override this by setting --matcher-type explicitly)
[WARNING] Using BOW matching, will use HAHOG feature type, not SIFT
[INFO]    ['use_exif_size: no', 'flann_algorithm: KDTREE', 'feature_process_size: 1440', 'feature_min_frames: 10000', 'processes: 11', 'matching_gps_neighbors: 0', 'matching_gps_distance: 0', 'matching_graph_rounds: 50', 'optimize_camera_parameters: yes', 'reconstruction_algorithm: incremental', 'undistorted_image_format: tif', 'bundle_outlier_filtering_type: AUTO', 'sift_peak_threshold: 0.066', 'align_orientation_prior: vertical', 'triangulation_type: ROBUST', 'retriangulation_ratio: 2', 'matcher_type: WORDS', 'feature_type: HAHOG', 'align_method: orientation_prior', 'local_bundle_radius: 0']
[INFO]    running "/code/SuperBuild/install/bin/opensfm/bin/opensfm" detect_features "/var/www/data/bd853eb0-fc89-4fbe-933a-77edcf965e08/opensfm"
2026-01-07 05:47:03,778 INFO: Planning to use 13375.008984375001 MB of RAM for both processing queue and parallel processing.
2026-01-07 05:47:03,779 INFO: Scale-space expected size of a single image : 47.09014892578125 MB
2026-01-07 05:47:03,779 INFO: Expecting to queue at most 200 images while parallel processing of 11 images.
2026-01-07 05:47:03,781 INFO: Reading data for image image_4.jpg (queue-size=0)
2026-01-07 05:47:03,781 INFO: Reading data for image image_1.jpg (queue-size=0)
2026-01-07 05:47:03,781 INFO: Reading data for image image_15.jpg (queue-size=0)
2026-01-07 05:47:03,781 INFO: Reading data for image image_16.jpg (queue-size=0)
2026-01-07 05:47:03,801 INFO: Reading data for image image_10.jpg (queue-size=1)
2026-01-07 05:47:03,801 INFO: Extracting ROOT_HAHOG features for image image_1.jpg
2026-01-07 05:47:03,802 INFO: Reading data for image image_2.jpg (queue-size=1)
2026-01-07 05:47:03,802 INFO: Reading data for image image_6.jpg (queue-size=2)
2026-01-07 05:47:03,802 INFO: Extracting ROOT_HAHOG features for image image_4.jpg
2026-01-07 05:47:03,802 INFO: Reading data for image image_8.jpg (queue-size=2)
2026-01-07 05:47:03,802 INFO: Extracting ROOT_HAHOG features for image image_15.jpg
2026-01-07 05:47:03,803 INFO: Extracting ROOT_HAHOG features for image image_16.jpg
2026-01-07 05:47:03,818 INFO: Reading data for image image_14.jpg (queue-size=1)
2026-01-07 05:47:03,818 INFO: Extracting ROOT_HAHOG features for image image_10.jpg
2026-01-07 05:47:03,819 INFO: Reading data for image image_9.jpg (queue-size=1)
2026-01-07 05:47:03,820 INFO: Extracting ROOT_HAHOG features for image image_2.jpg
2026-01-07 05:47:03,822 INFO: Reading data for image image_7.jpg (queue-size=1)
2026-01-07 05:47:03,822 INFO: Extracting ROOT_HAHOG features for image image_6.jpg
2026-01-07 05:47:03,827 INFO: Extracting ROOT_HAHOG features for image image_8.jpg
2026-01-07 05:47:03,835 INFO: Reading data for image image_13.jpg (queue-size=1)
2026-01-07 05:47:03,849 INFO: Reading data for image image_5.jpg (queue-size=2)
2026-01-07 05:47:03,861 INFO: Reading data for image image_12.jpg (queue-size=3)
2026-01-07 05:47:03,882 INFO: Reading data for image image_17.jpg (queue-size=4)
2026-01-07 05:47:03,882 INFO: Reading data for image image_3.jpg (queue-size=5)
2026-01-07 05:47:03,893 INFO: Extracting ROOT_HAHOG features for image image_14.jpg
2026-01-07 05:47:03,898 INFO: Extracting ROOT_HAHOG features for image image_9.jpg
2026-01-07 05:47:03,907 INFO: Reading data for image image_11.jpg (queue-size=6)
2026-01-07 05:47:03,951 INFO: Finished reading images
2026-01-07 05:47:03,951 INFO: Extracting ROOT_HAHOG features for image image_13.jpg
2026-01-07 05:47:04,748 DEBUG: Found 8300 points in 0.921541690826416s
2026-01-07 05:47:04,749 DEBUG: Found 9098 points in 0.9263918399810791s
2026-01-07 05:47:04,755 DEBUG: Found 8705 points in 0.9514298439025879s
2026-01-07 05:47:04,796 DEBUG: Found 9017 points in 0.9909634590148926s
2026-01-07 05:47:04,804 DEBUG: Found 8110 points in 0.9727134704589844s
2026-01-07 05:47:04,816 DEBUG: Found 9403 points in 1.0102124214172363s
2026-01-07 05:47:04,877 DEBUG: Found 8980 points in 0.9781975746154785s
2026-01-07 05:47:04,893 DEBUG: Found 8842 points in 1.088554859161377s
2026-01-07 05:47:04,912 DEBUG: Found 9200 points in 0.9605700969696045s
2026-01-07 05:47:04,937 DEBUG: Found 9230 points in 1.0433714389801025s
2026-01-07 05:47:04,961 DEBUG: Found 8473 points in 1.1328744888305664s
2026-01-07 05:47:05,898 INFO: Extracting ROOT_HAHOG features for image image_5.jpg
2026-01-07 05:47:05,921 INFO: Extracting ROOT_HAHOG features for image image_7.jpg
2026-01-07 05:47:06,057 INFO: Extracting ROOT_HAHOG features for image image_12.jpg
2026-01-07 05:47:06,073 INFO: Extracting ROOT_HAHOG features for image image_17.jpg
2026-01-07 05:47:06,161 INFO: Extracting ROOT_HAHOG features for image image_3.jpg
2026-01-07 05:47:06,171 INFO: Extracting ROOT_HAHOG features for image image_11.jpg
2026-01-07 05:47:06,546 DEBUG: Found 8618 points in 0.647449254989624s
2026-01-07 05:47:06,602 DEBUG: Found 7885 points in 0.6808481216430664s
2026-01-07 05:47:06,645 DEBUG: Found 8588 points in 0.5876860618591309s
2026-01-07 05:47:06,683 DEBUG: Found 9408 points in 0.6101062297821045s
2026-01-07 05:47:06,732 DEBUG: Found 8375 points in 0.5705485343933105s
2026-01-07 05:47:06,763 DEBUG: Found 8580 points in 0.5914506912231445s
[INFO]    running "/code/SuperBuild/install/bin/opensfm/bin/opensfm" match_features "/var/www/data/bd853eb0-fc89-4fbe-933a-77edcf965e08/opensfm"
2026-01-07 05:47:08,230 INFO: Matching 136 image pairs
2026-01-07 05:47:08,231 INFO: Computing pair matching with 11 processes
2026-01-07 05:47:08,380 DEBUG: Matching image_11.jpg and image_12.jpg.  Matcher: WORDS (symmetric) T-desc: 0.121 T-robust: 0.020 T-total: 0.141 Matches: 503 Robust: 260 Success: True
2026-01-07 05:47:08,445 DEBUG: Matching image_12.jpg and image_7.jpg.  Matcher: WORDS (symmetric) T-desc: 0.203 T-robust: 0.003 T-total: 0.207 Matches: 212 Robust: 162 Success: True
2026-01-07 05:47:08,559 DEBUG: Matching image_11.jpg and image_3.jpg.  Matcher: WORDS (symmetric) T-desc: 0.294 T-robust: 0.027 T-total: 0.322 Matches: 205 Robust: 151 Success: True
2026-01-07 05:47:08,592 DEBUG: Matching image_11.jpg and image_4.jpg.  Matcher: WORDS (symmetric) T-desc: 0.325 T-robust: 0.002 T-total: 0.357 Matches: 164 Robust: 119 Success: True
2026-01-07 05:47:08,675 DEBUG: Matching image_14.jpg and image_4.jpg.  Matcher: WORDS (symmetric) T-desc: 0.055 T-robust: 0.028 T-total: 0.083 Matches: 218 Robust: 166 Success: True
2026-01-07 05:47:08,706 DEBUG: Matching image_14.jpg and image_8.jpg.  Matcher: WORDS (symmetric) T-desc: 0.441 T-robust: 0.003 T-total: 0.472 Matches: 188 Robust: 143 Success: True
2026-01-07 05:47:08,737 DEBUG: Matching image_14.jpg and image_12.jpg.  Matcher: WORDS (symmetric) T-desc: 0.056 T-robust: 0.003 T-total: 0.059 Matches: 219 Robust: 134 Success: True
2026-01-07 05:47:08,841 DEBUG: Matching image_7.jpg and image_9.jpg.  Matcher: WORDS (symmetric) T-desc: 0.551 T-robust: 0.052 T-total: 0.602 Matches: 238 Robust: 182 Success: True
2026-01-07 05:47:08,924 DEBUG: Matching image_7.jpg and image_2.jpg.  Matcher: WORDS (symmetric) T-desc: 0.602 T-robust: 0.083 T-total: 0.686 Matches: 252 Robust: 214 Success: True
2026-01-07 05:47:08,926 DEBUG: Matching image_4.jpg and image_10.jpg.  Matcher: WORDS (symmetric) T-desc: 0.691 T-robust: 0.001 T-total: 0.692 Matches: 173 Robust: 122 Success: True
2026-01-07 05:47:09,005 DEBUG: Matching image_8.jpg and image_2.jpg.  Matcher: WORDS (symmetric) T-desc: 0.078 T-robust: 0.001 T-total: 0.079 Matches: 215 Robust: 174 Success: True
2026-01-07 05:47:09,091 DEBUG: Matching image_14.jpg and image_11.jpg.  Matcher: WORDS (symmetric) T-desc: 0.164 T-robust: 0.027 T-total: 0.250 Matches: 205 Robust: 134 Success: True
2026-01-07 05:47:09,119 DEBUG: Matching image_8.jpg and image_16.jpg.  Matcher: WORDS (symmetric) T-desc: 0.827 T-robust: 0.057 T-total: 0.885 Matches: 149 Robust: 117 Success: True
2026-01-07 05:47:09,122 DEBUG: Matching image_14.jpg and image_10.jpg.  Matcher: WORDS (symmetric) T-desc: 0.113 T-robust: 0.003 T-total: 0.116 Matches: 182 Robust: 118 Success: True
2026-01-07 05:47:09,183 DEBUG: Matching image_1.jpg and image_10.jpg.  Matcher: WORDS (symmetric) T-desc: 0.947 T-robust: 0.001 T-total: 0.948 Matches: 189 Robust: 141 Success: True
2026-01-07 05:47:09,346 DEBUG: Matching image_8.jpg and image_9.jpg.  Matcher: WORDS (symmetric) T-desc: 0.055 T-robust: 0.107 T-total: 0.163 Matches: 532 Robust: 304 Success: True
2026-01-07 05:47:09,401 DEBUG: Matching image_4.jpg and image_5.jpg.  Matcher: WORDS (symmetric) T-desc: 1.082 T-robust: 0.083 T-total: 1.165 Matches: 501 Robust: 306 Success: True
2026-01-07 05:47:09,456 DEBUG: Matching image_1.jpg and image_3.jpg.  Matcher: WORDS (symmetric) T-desc: 0.054 T-robust: 0.055 T-total: 0.110 Matches: 307 Robust: 211 Success: True
2026-01-07 05:47:09,457 DEBUG: Matching image_16.jpg and image_7.jpg.  Matcher: WORDS (symmetric) T-desc: 0.054 T-robust: 0.002 T-total: 0.056 Matches: 193 Robust: 148 Success: True
2026-01-07 05:47:09,457 DEBUG: Matching image_11.jpg and image_10.jpg.  Matcher: WORDS (symmetric) T-desc: 0.558 T-robust: 0.110 T-total: 0.668 Matches: 543 Robust: 274 Success: True
2026-01-07 05:47:09,579 DEBUG: Matching image_16.jpg and image_2.jpg.  Matcher: WORDS (symmetric) T-desc: 0.120 T-robust: 0.001 T-total: 0.122 Matches: 205 Robust: 156 Success: True
2026-01-07 05:47:09,581 DEBUG: Matching image_13.jpg and image_10.jpg.  Matcher: WORDS (symmetric) T-desc: 1.196 T-robust: 0.003 T-total: 1.200 Matches: 226 Robust: 155 Success: True
2026-01-07 05:47:09,693 DEBUG: Matching image_4.jpg and image_15.jpg.  Matcher: WORDS (symmetric) T-desc: 1.194 T-robust: 0.029 T-total: 1.248 Matches: 195 Robust: 155 Success: True
2026-01-07 05:47:09,751 DEBUG: Matching image_15.jpg and image_2.jpg.  Matcher: WORDS (symmetric) T-desc: 0.602 T-robust: 0.027 T-total: 0.629 Matches: 206 Robust: 163 Success: True
2026-01-07 05:47:09,804 DEBUG: Matching image_16.jpg and image_9.jpg.  Matcher: WORDS (symmetric) T-desc: 0.057 T-robust: 0.053 T-total: 0.110 Matches: 160 Robust: 117 Success: True
2026-01-07 05:47:09,966 DEBUG: Matching image_12.jpg and image_2.jpg.  Matcher: WORDS (symmetric) T-desc: 0.052 T-robust: 0.080 T-total: 0.214 Matches: 175 Robust: 141 Success: True
2026-01-07 05:47:10,042 DEBUG: Matching image_6.jpg and image_9.jpg.  Matcher: WORDS (symmetric) T-desc: 1.259 T-robust: 0.075 T-total: 1.336 Matches: 193 Robust: 146 Success: True
2026-01-07 05:47:10,071 DEBUG: Matching image_17.jpg and image_3.jpg.  Matcher: WORDS (symmetric) T-desc: 1.405 T-robust: 0.076 T-total: 1.512 Matches: 192 Robust: 152 Success: True
2026-01-07 05:47:10,205 DEBUG: Matching image_10.jpg and image_15.jpg.  Matcher: WORDS (symmetric) T-desc: 0.846 T-robust: 0.134 T-total: 1.086 Matches: 157 Robust: 100 Success: True
2026-01-07 05:47:10,206 DEBUG: Matching image_12.jpg and image_15.jpg.  Matcher: WORDS (symmetric) T-desc: 1.146 T-robust: 0.029 T-total: 1.282 Matches: 162 Robust: 110 Success: True
2026-01-07 05:47:10,288 DEBUG: Matching image_7.jpg and image_6.jpg.  Matcher: WORDS (symmetric) T-desc: 0.075 T-robust: 0.136 T-total: 0.323 Matches: 473 Robust: 280 Success: True
2026-01-07 05:47:10,472 DEBUG: Matching image_4.jpg and image_13.jpg.  Matcher: WORDS (symmetric) T-desc: 0.110 T-robust: 0.213 T-total: 0.347 Matches: 210 Robust: 164 Success: True
2026-01-07 05:47:10,473 DEBUG: Matching image_4.jpg and image_1.jpg.  Matcher: WORDS (symmetric) T-desc: 0.135 T-robust: 0.164 T-total: 0.402 Matches: 360 Robust: 277 Success: True
2026-01-07 05:47:10,583 DEBUG: Matching image_15.jpg and image_9.jpg.  Matcher: WORDS (symmetric) T-desc: 0.920 T-robust: 0.082 T-total: 1.002 Matches: 162 Robust: 128 Success: True
2026-01-07 05:47:10,583 DEBUG: Matching image_12.jpg and image_16.jpg.  Matcher: WORDS (symmetric) T-desc: 0.160 T-robust: 0.134 T-total: 0.295 Matches: 152 Robust: 108 Success: True
2026-01-07 05:47:10,732 DEBUG: Matching image_2.jpg and image_17.jpg.  Matcher: WORDS (symmetric) T-desc: 1.029 T-robust: 0.058 T-total: 1.150 Matches: 186 Robust: 151 Success: True
2026-01-07 05:47:10,732 DEBUG: Matching image_16.jpg and image_15.jpg.  Matcher: WORDS (symmetric) T-desc: 0.111 T-robust: 0.238 T-total: 0.527 Matches: 504 Robust: 280 Success: True
2026-01-07 05:47:10,733 DEBUG: Matching image_9.jpg and image_5.jpg.  Matcher: WORDS (symmetric) T-desc: 0.110 T-robust: 0.086 T-total: 0.260 Matches: 176 Robust: 133 Success: True
2026-01-07 05:47:10,870 DEBUG: Matching image_15.jpg and image_5.jpg.  Matcher: WORDS (symmetric) T-desc: 0.764 T-robust: 0.355 T-total: 1.291 Matches: 168 Robust: 132 Success: True
2026-01-07 05:47:10,926 DEBUG: Matching image_2.jpg and image_6.jpg.  Matcher: WORDS (symmetric) T-desc: 1.491 T-robust: 0.288 T-total: 1.835 Matches: 297 Robust: 229 Success: True
2026-01-07 05:47:10,927 DEBUG: Matching image_7.jpg and image_17.jpg.  Matcher: WORDS (symmetric) T-desc: 0.187 T-robust: 0.204 T-total: 0.585 Matches: 189 Robust: 150 Success: True
2026-01-07 05:47:10,981 DEBUG: Matching image_12.jpg and image_5.jpg.  Matcher: WORDS (symmetric) T-desc: 0.371 T-robust: 0.082 T-total: 0.508 Matches: 191 Robust: 149 Success: True
2026-01-07 05:47:11,053 DEBUG: Matching image_12.jpg and image_1.jpg.  Matcher: WORDS (symmetric) T-desc: 0.193 T-robust: 0.031 T-total: 0.321 Matches: 189 Robust: 143 Success: True
2026-01-07 05:47:11,080 DEBUG: Matching image_12.jpg and image_9.jpg.  Matcher: WORDS (symmetric) T-desc: 0.149 T-robust: 0.138 T-total: 0.497 Matches: 196 Robust: 132 Success: True
2026-01-07 05:47:11,080 DEBUG: Matching image_13.jpg and image_7.jpg.  Matcher: WORDS (symmetric) T-desc: 0.152 T-robust: 0.001 T-total: 0.153 Matches: 222 Robust: 179 Success: True
2026-01-07 05:47:11,081 DEBUG: Matching image_4.jpg and image_2.jpg.  Matcher: WORDS (symmetric) T-desc: 0.194 T-robust: 0.054 T-total: 0.349 Matches: 324 Robust: 243 Success: True
2026-01-07 05:47:11,132 DEBUG: Matching image_16.jpg and image_5.jpg.  Matcher: WORDS (symmetric) T-desc: 0.344 T-robust: 0.154 T-total: 0.550 Matches: 214 Robust: 159 Success: True
2026-01-07 05:47:11,133 DEBUG: Matching image_11.jpg and image_7.jpg.  Matcher: WORDS (symmetric) T-desc: 0.211 T-robust: 0.052 T-total: 0.263 Matches: 215 Robust: 171 Success: True
2026-01-07 05:47:11,327 DEBUG: Matching image_1.jpg and image_2.jpg.  Matcher: WORDS (symmetric) T-desc: 0.238 T-robust: 0.134 T-total: 0.457 Matches: 706 Robust: 408 Success: True
2026-01-07 05:47:11,353 DEBUG: Matching image_4.jpg and image_9.jpg.  Matcher: WORDS (symmetric) T-desc: 0.162 T-robust: 0.084 T-total: 0.299 Matches: 170 Robust: 135 Success: True
2026-01-07 05:47:11,464 DEBUG: Matching image_1.jpg and image_7.jpg.  Matcher: WORDS (symmetric) T-desc: 0.206 T-robust: 0.057 T-total: 0.539 Matches: 259 Robust: 208 Success: True
2026-01-07 05:47:11,625 DEBUG: Matching image_1.jpg and image_9.jpg.  Matcher: WORDS (symmetric) T-desc: 0.333 T-robust: 0.102 T-total: 0.464 Matches: 197 Robust: 152 Success: True
2026-01-07 05:47:11,654 DEBUG: Matching image_1.jpg and image_15.jpg.  Matcher: WORDS (symmetric) T-desc: 0.165 T-robust: 0.190 T-total: 0.383 Matches: 192 Robust: 149 Success: True
2026-01-07 05:47:11,737 DEBUG: Matching image_4.jpg and image_16.jpg.  Matcher: WORDS (symmetric) T-desc: 0.271 T-robust: 0.029 T-total: 0.383 Matches: 210 Robust: 169 Success: True
2026-01-07 05:47:11,822 DEBUG: Matching image_13.jpg and image_3.jpg.  Matcher: WORDS (symmetric) T-desc: 0.245 T-robust: 0.053 T-total: 0.495 Matches: 211 Robust: 162 Success: True
2026-01-07 05:47:11,903 DEBUG: Matching image_14.jpg and image_3.jpg.  Matcher: WORDS (symmetric) T-desc: 0.108 T-robust: 0.496 T-total: 0.770 Matches: 206 Robust: 165 Success: True
2026-01-07 05:47:11,967 DEBUG: Matching image_14.jpg and image_7.jpg.  Matcher: WORDS (symmetric) T-desc: 0.522 T-robust: 0.055 T-total: 0.834 Matches: 222 Robust: 183 Success: True
2026-01-07 05:47:12,054 DEBUG: Matching image_6.jpg and image_17.jpg.  Matcher: WORDS (symmetric) T-desc: 2.539 T-robust: 0.058 T-total: 2.598 Matches: 191 Robust: 145 Success: True
2026-01-07 05:47:12,055 DEBUG: Matching image_8.jpg and image_6.jpg.  Matcher: WORDS (symmetric) T-desc: 0.357 T-robust: 0.081 T-total: 0.590 Matches: 234 Robust: 168 Success: True
2026-01-07 05:47:12,082 DEBUG: Matching image_10.jpg and image_6.jpg.  Matcher: WORDS (symmetric) T-desc: 0.331 T-robust: 0.481 T-total: 0.841 Matches: 177 Robust: 125 Success: True
2026-01-07 05:47:12,164 DEBUG: Matching image_4.jpg and image_6.jpg.  Matcher: WORDS (symmetric) T-desc: 0.201 T-robust: 0.115 T-total: 0.426 Matches: 297 Robust: 247 Success: True
2026-01-07 05:47:12,192 DEBUG: Matching image_13.jpg and image_5.jpg.  Matcher: WORDS (symmetric) T-desc: 0.230 T-robust: 0.083 T-total: 0.370 Matches: 209 Robust: 164 Success: True
2026-01-07 05:47:12,319 DEBUG: Matching image_10.jpg and image_17.jpg.  Matcher: WORDS (symmetric) T-desc: 0.399 T-robust: 0.169 T-total: 0.665 Matches: 163 Robust: 116 Success: True
2026-01-07 05:47:12,377 DEBUG: Matching image_17.jpg and image_5.jpg.  Matcher: WORDS (symmetric) T-desc: 2.249 T-robust: 0.139 T-total: 2.573 Matches: 188 Robust: 154 Success: True
2026-01-07 05:47:12,460 DEBUG: Matching image_1.jpg and image_5.jpg.  Matcher: WORDS (symmetric) T-desc: 0.149 T-robust: 0.325 T-total: 0.557 Matches: 317 Robust: 238 Success: True
2026-01-07 05:47:12,516 DEBUG: Matching image_1.jpg and image_16.jpg.  Matcher: WORDS (symmetric) T-desc: 0.695 T-robust: 0.086 T-total: 0.891 Matches: 195 Robust: 146 Success: True
2026-01-07 05:47:12,570 DEBUG: Matching image_14.jpg and image_2.jpg.  Matcher: WORDS (symmetric) T-desc: 0.157 T-robust: 0.195 T-total: 0.406 Matches: 216 Robust: 178 Success: True
2026-01-07 05:47:12,598 DEBUG: Matching image_14.jpg and image_13.jpg.  Matcher: WORDS (symmetric) T-desc: 0.141 T-robust: 0.860 T-total: 1.001 Matches: 469 Robust: 256 Success: True
2026-01-07 05:47:12,598 DEBUG: Matching image_11.jpg and image_13.jpg.  Matcher: WORDS (symmetric) T-desc: 0.378 T-robust: 0.164 T-total: 0.543 Matches: 270 Robust: 166 Success: True
2026-01-07 05:47:12,675 DEBUG: Matching image_13.jpg and image_12.jpg.  Matcher: WORDS (symmetric) T-desc: 0.211 T-robust: 0.223 T-total: 0.593 Matches: 464 Robust: 203 Success: True
2026-01-07 05:47:12,728 DEBUG: Matching image_14.jpg and image_9.jpg.  Matcher: WORDS (symmetric) T-desc: 0.192 T-robust: 0.132 T-total: 0.351 Matches: 189 Robust: 136 Success: True
2026-01-07 05:47:12,729 DEBUG: Matching image_8.jpg and image_17.jpg.  Matcher: WORDS (symmetric) T-desc: 0.324 T-robust: 0.158 T-total: 0.536 Matches: 187 Robust: 143 Success: True
2026-01-07 05:47:12,729 DEBUG: Matching image_11.jpg and image_5.jpg.  Matcher: WORDS (symmetric) T-desc: 0.139 T-robust: 0.406 T-total: 0.675 Matches: 174 Robust: 133 Success: True
2026-01-07 05:47:12,758 DEBUG: Matching image_14.jpg and image_5.jpg.  Matcher: WORDS (symmetric) T-desc: 0.594 T-robust: 0.053 T-total: 0.676 Matches: 201 Robust: 158 Success: True
2026-01-07 05:47:12,974 DEBUG: Matching image_11.jpg and image_2.jpg.  Matcher: WORDS (symmetric) T-desc: 0.130 T-robust: 0.222 T-total: 0.377 Matches: 210 Robust: 170 Success: True
2026-01-07 05:47:12,975 DEBUG: Matching image_6.jpg and image_3.jpg.  Matcher: WORDS (symmetric) T-desc: 0.158 T-robust: 0.169 T-total: 0.405 Matches: 209 Robust: 169 Success: True
2026-01-07 05:47:12,975 DEBUG: Matching image_11.jpg and image_15.jpg.  Matcher: WORDS (symmetric) T-desc: 0.350 T-robust: 0.083 T-total: 0.459 Matches: 150 Robust: 95 Success: True
2026-01-07 05:47:13,003 DEBUG: Matching image_3.jpg and image_5.jpg.  Matcher: WORDS (symmetric) T-desc: 0.215 T-robust: 0.135 T-total: 0.543 Matches: 272 Robust: 203 Success: True
2026-01-07 05:47:13,029 DEBUG: Matching image_11.jpg and image_9.jpg.  Matcher: WORDS (symmetric) T-desc: 0.279 T-robust: 0.404 T-total: 0.709 Matches: 281 Robust: 187 Success: True
2026-01-07 05:47:13,203 DEBUG: Matching image_11.jpg and image_16.jpg.  Matcher: WORDS (symmetric) T-desc: 0.138 T-robust: 0.188 T-total: 0.444 Matches: 161 Robust: 107 Success: True
2026-01-07 05:47:13,291 DEBUG: Matching image_15.jpg and image_6.jpg.  Matcher: WORDS (symmetric) T-desc: 0.247 T-robust: 0.256 T-total: 0.562 Matches: 192 Robust: 143 Success: True
2026-01-07 05:47:13,348 DEBUG: Matching image_10.jpg and image_9.jpg.  Matcher: WORDS (symmetric) T-desc: 0.301 T-robust: 0.232 T-total: 0.618 Matches: 455 Robust: 252 Success: True
2026-01-07 05:47:13,376 DEBUG: Matching image_16.jpg and image_6.jpg.  Matcher: WORDS (symmetric) T-desc: 0.502 T-robust: 0.117 T-total: 0.647 Matches: 181 Robust: 140 Success: True
2026-01-07 05:47:13,514 DEBUG: Matching image_8.jpg and image_4.jpg.  Matcher: WORDS (symmetric) T-desc: 0.287 T-robust: 0.199 T-total: 0.539 Matches: 192 Robust: 147 Success: True
2026-01-07 05:47:13,647 DEBUG: Matching image_13.jpg and image_15.jpg.  Matcher: WORDS (symmetric) T-desc: 0.428 T-robust: 0.109 T-total: 0.644 Matches: 274 Robust: 186 Success: True
2026-01-07 05:47:13,677 DEBUG: Matching image_14.jpg and image_16.jpg.  Matcher: WORDS (symmetric) T-desc: 0.432 T-robust: 0.186 T-total: 0.648 Matches: 249 Robust: 156 Success: True
2026-01-07 05:47:13,704 DEBUG: Matching image_4.jpg and image_17.jpg.  Matcher: WORDS (symmetric) T-desc: 0.703 T-robust: 0.216 T-total: 0.976 Matches: 198 Robust: 160 Success: True
2026-01-07 05:47:13,705 DEBUG: Matching image_8.jpg and image_7.jpg.  Matcher: WORDS (symmetric) T-desc: 0.586 T-robust: 0.225 T-total: 1.030 Matches: 337 Robust: 213 Success: True
2026-01-07 05:47:13,705 DEBUG: Matching image_2.jpg and image_3.jpg.  Matcher: WORDS (symmetric) T-desc: 0.328 T-robust: 0.028 T-total: 0.414 Matches: 482 Robust: 311 Success: True
2026-01-07 05:47:13,731 DEBUG: Matching image_8.jpg and image_11.jpg.  Matcher: WORDS (symmetric) T-desc: 0.137 T-robust: 0.163 T-total: 0.355 Matches: 251 Robust: 185 Success: True
2026-01-07 05:47:13,732 DEBUG: Matching image_15.jpg and image_17.jpg.  Matcher: WORDS (symmetric) T-desc: 0.486 T-robust: 0.244 T-total: 0.757 Matches: 262 Robust: 172 Success: True
2026-01-07 05:47:13,869 DEBUG: Matching image_7.jpg and image_3.jpg.  Matcher: WORDS (symmetric) T-desc: 0.134 T-robust: 0.110 T-total: 0.355 Matches: 235 Robust: 198 Success: True
2026-01-07 05:47:13,950 DEBUG: Matching image_14.jpg and image_15.jpg.  Matcher: WORDS (symmetric) T-desc: 0.258 T-robust: 0.635 T-total: 0.975 Matches: 669 Robust: 382 Success: True
2026-01-07 05:47:14,006 DEBUG: Matching image_8.jpg and image_12.jpg.  Matcher: WORDS (symmetric) T-desc: 0.190 T-robust: 0.057 T-total: 0.274 Matches: 232 Robust: 183 Success: True
2026-01-07 05:47:14,006 DEBUG: Matching image_9.jpg and image_17.jpg.  Matcher: WORDS (symmetric) T-desc: 0.190 T-robust: 0.111 T-total: 0.328 Matches: 157 Robust: 117 Success: True
2026-01-07 05:47:14,006 DEBUG: Matching image_16.jpg and image_17.jpg.  Matcher: WORDS (symmetric) T-desc: 0.418 T-robust: 0.330 T-total: 0.804 Matches: 922 Robust: 623 Success: True
2026-01-07 05:47:14,195 DEBUG: Matching image_14.jpg and image_1.jpg.  Matcher: WORDS (symmetric) T-desc: 0.110 T-robust: 0.222 T-total: 0.547 Matches: 220 Robust: 176 Success: True
2026-01-07 05:47:14,195 DEBUG: Matching image_8.jpg and image_10.jpg.  Matcher: WORDS (symmetric) T-desc: 0.330 T-robust: 0.487 T-total: 0.848 Matches: 332 Robust: 219 Success: True
2026-01-07 05:47:14,307 DEBUG: Matching image_11.jpg and image_1.jpg.  Matcher: WORDS (symmetric) T-desc: 0.110 T-robust: 0.028 T-total: 0.438 Matches: 193 Robust: 144 Success: True
2026-01-07 05:47:14,342 DEBUG: Matching image_8.jpg and image_5.jpg.  Matcher: WORDS (symmetric) T-desc: 0.214 T-robust: 0.030 T-total: 0.391 Matches: 205 Robust: 160 Success: True
2026-01-07 05:47:14,454 DEBUG: Matching image_13.jpg and image_1.jpg.  Matcher: WORDS (symmetric) T-desc: 0.335 T-robust: 0.087 T-total: 0.448 Matches: 223 Robust: 179 Success: True
2026-01-07 05:47:14,506 DEBUG: Matching image_8.jpg and image_3.jpg.  Matcher: WORDS (symmetric) T-desc: 0.409 T-robust: 0.365 T-total: 0.801 Matches: 228 Robust: 177 Success: True
2026-01-07 05:47:14,506 DEBUG: Matching image_12.jpg and image_6.jpg.  Matcher: WORDS (symmetric) T-desc: 0.177 T-robust: 0.057 T-total: 0.311 Matches: 165 Robust: 121 Success: True
2026-01-07 05:47:14,506 DEBUG: Matching image_12.jpg and image_17.jpg.  Matcher: WORDS (symmetric) T-desc: 0.275 T-robust: 0.500 T-total: 0.802 Matches: 183 Robust: 130 Success: True
2026-01-07 05:47:14,638 DEBUG: Matching image_13.jpg and image_9.jpg.  Matcher: WORDS (symmetric) T-desc: 0.326 T-robust: 0.207 T-total: 0.769 Matches: 203 Robust: 136 Success: True
2026-01-07 05:47:14,638 DEBUG: Matching image_15.jpg and image_3.jpg.  Matcher: WORDS (symmetric) T-desc: 0.215 T-robust: 0.444 T-total: 0.659 Matches: 196 Robust: 157 Success: True
2026-01-07 05:47:14,667 DEBUG: Matching image_6.jpg and image_5.jpg.  Matcher: WORDS (symmetric) T-desc: 0.302 T-robust: 0.253 T-total: 0.661 Matches: 496 Robust: 296 Success: True
2026-01-07 05:47:14,745 DEBUG: Matching image_16.jpg and image_3.jpg.  Matcher: WORDS (symmetric) T-desc: 0.233 T-robust: 0.162 T-total: 0.473 Matches: 197 Robust: 154 Success: True
2026-01-07 05:47:14,879 DEBUG: Matching image_13.jpg and image_6.jpg.  Matcher: WORDS (symmetric) T-desc: 0.186 T-robust: 0.026 T-total: 0.347 Matches: 207 Robust: 166 Success: True
2026-01-07 05:47:14,880 DEBUG: Matching image_13.jpg and image_2.jpg.  Matcher: WORDS (symmetric) T-desc: 0.233 T-robust: 0.051 T-total: 0.685 Matches: 235 Robust: 181 Success: True
2026-01-07 05:47:14,989 DEBUG: Matching image_1.jpg and image_17.jpg.  Matcher: WORDS (symmetric) T-desc: 0.133 T-robust: 0.082 T-total: 0.243 Matches: 204 Robust: 152 Success: True
2026-01-07 05:47:14,989 DEBUG: Matching image_2.jpg and image_5.jpg.  Matcher: WORDS (symmetric) T-desc: 0.316 T-robust: 0.216 T-total: 0.560 Matches: 289 Robust: 228 Success: True
2026-01-07 05:47:15,041 DEBUG: Matching image_13.jpg and image_16.jpg.  Matcher: WORDS (symmetric) T-desc: 0.373 T-robust: 0.109 T-total: 0.535 Matches: 207 Robust: 147 Success: True
2026-01-07 05:47:15,066 DEBUG: Matching image_10.jpg and image_7.jpg.  Matcher: WORDS (symmetric) T-desc: 0.108 T-robust: 0.158 T-total: 0.694 Matches: 215 Robust: 159 Success: True
2026-01-07 05:47:15,148 DEBUG: Matching image_8.jpg and image_15.jpg.  Matcher: WORDS (symmetric) T-desc: 0.480 T-robust: 0.053 T-total: 0.693 Matches: 175 Robust: 130 Success: True
2026-01-07 05:47:15,148 DEBUG: Matching image_2.jpg and image_9.jpg.  Matcher: WORDS (symmetric) T-desc: 0.187 T-robust: 0.136 T-total: 0.510 Matches: 202 Robust: 165 Success: True
2026-01-07 05:47:15,231 DEBUG: Matching image_4.jpg and image_7.jpg.  Matcher: WORDS (symmetric) T-desc: 0.186 T-robust: 0.138 T-total: 0.352 Matches: 240 Robust: 195 Success: True
2026-01-07 05:47:15,336 DEBUG: Matching image_11.jpg and image_6.jpg.  Matcher: WORDS (symmetric) T-desc: 0.213 T-robust: 0.211 T-total: 0.669 Matches: 179 Robust: 134 Success: True
2026-01-07 05:47:15,365 DEBUG: Matching image_1.jpg and image_6.jpg.  Matcher: WORDS (symmetric) T-desc: 0.403 T-robust: 0.107 T-total: 0.728 Matches: 316 Robust: 267 Success: True
2026-01-07 05:47:15,447 DEBUG: Matching image_7.jpg and image_5.jpg.  Matcher: WORDS (symmetric) T-desc: 0.456 T-robust: 0.349 T-total: 0.941 Matches: 268 Robust: 194 Success: True
2026-01-07 05:47:15,448 DEBUG: Matching image_13.jpg and image_17.jpg.  Matcher: WORDS (symmetric) T-desc: 0.376 T-robust: 0.082 T-total: 0.459 Matches: 246 Robust: 174 Success: True
2026-01-07 05:47:15,473 DEBUG: Matching image_11.jpg and image_17.jpg.  Matcher: WORDS (symmetric) T-desc: 0.158 T-robust: 0.301 T-total: 0.484 Matches: 191 Robust: 135 Success: True
2026-01-07 05:47:15,632 DEBUG: Matching image_14.jpg and image_6.jpg.  Matcher: WORDS (symmetric) T-desc: 0.210 T-robust: 0.058 T-total: 0.295 Matches: 201 Robust: 152 Success: True
2026-01-07 05:47:15,745 DEBUG: Matching image_10.jpg and image_5.jpg.  Matcher: WORDS (symmetric) T-desc: 0.401 T-robust: 0.027 T-total: 0.514 Matches: 157 Robust: 121 Success: True
2026-01-07 05:47:15,771 DEBUG: Matching image_12.jpg and image_3.jpg.  Matcher: WORDS (symmetric) T-desc: 0.184 T-robust: 0.055 T-total: 0.324 Matches: 214 Robust: 159 Success: True
2026-01-07 05:47:15,772 DEBUG: Matching image_12.jpg and image_10.jpg.  Matcher: WORDS (symmetric) T-desc: 0.352 T-robust: 0.294 T-total: 0.731 Matches: 264 Robust: 184 Success: True
2026-01-07 05:47:15,773 DEBUG: Matching image_4.jpg and image_12.jpg.  Matcher: WORDS (symmetric) T-desc: 0.135 T-robust: 0.082 T-total: 0.542 Matches: 174 Robust: 127 Success: True
2026-01-07 05:47:15,799 DEBUG: Matching image_9.jpg and image_3.jpg.  Matcher: WORDS (symmetric) T-desc: 0.512 T-robust: 0.027 T-total: 0.652 Matches: 211 Robust: 173 Success: True
2026-01-07 05:47:15,858 DEBUG: Matching image_4.jpg and image_3.jpg.  Matcher: WORDS (symmetric) T-desc: 0.351 T-robust: 0.541 T-total: 0.978 Matches: 370 Robust: 235 Success: True
2026-01-07 05:47:15,859 DEBUG: Matching image_10.jpg and image_2.jpg.  Matcher: WORDS (symmetric) T-desc: 0.324 T-robust: 0.086 T-total: 0.411 Matches: 175 Robust: 129 Success: True
2026-01-07 05:47:15,885 DEBUG: Matching image_14.jpg and image_17.jpg.  Matcher: WORDS (symmetric) T-desc: 0.299 T-robust: 0.028 T-total: 0.412 Matches: 241 Robust: 175 Success: True
2026-01-07 05:47:15,885 DEBUG: Matching image_10.jpg and image_3.jpg.  Matcher: WORDS (symmetric) T-desc: 0.382 T-robust: 0.352 T-total: 0.819 Matches: 196 Robust: 156 Success: True
2026-01-07 05:47:15,886 DEBUG: Matching image_10.jpg and image_16.jpg.  Matcher: WORDS (symmetric) T-desc: 0.408 T-robust: 0.112 T-total: 0.520 Matches: 168 Robust: 107 Success: True
2026-01-07 05:47:15,914 DEBUG: Matching image_8.jpg and image_1.jpg.  Matcher: WORDS (symmetric) T-desc: 0.113 T-robust: 0.029 T-total: 0.142 Matches: 191 Robust: 154 Success: True
2026-01-07 05:47:15,914 DEBUG: Matching image_8.jpg and image_13.jpg.  Matcher: WORDS (symmetric) T-desc: 0.224 T-robust: 0.030 T-total: 0.255 Matches: 219 Robust: 161 Success: True
2026-01-07 05:47:15,915 DEBUG: Matching image_7.jpg and image_15.jpg.  Matcher: WORDS (symmetric) T-desc: 0.055 T-robust: 0.001 T-total: 0.056 Matches: 187 Robust: 148 Success: True
2026-01-07 05:47:15,927 INFO: Matched 136 pairs (brown-brown: 136) in 7.697417212000801 seconds (0.056598659345588526 seconds/pair).
[INFO]    running "/code/SuperBuild/install/bin/opensfm/bin/opensfm" create_tracks "/var/www/data/bd853eb0-fc89-4fbe-933a-77edcf965e08/opensfm"
2026-01-07 05:47:16,893 INFO: reading features
2026-01-07 05:47:16,990 DEBUG: Merging features onto tracks
2026-01-07 05:47:17,032 DEBUG: Good tracks: 4305
[INFO]    running "/code/SuperBuild/install/bin/opensfm/bin/opensfm" reconstruct "/var/www/data/bd853eb0-fc89-4fbe-933a-77edcf965e08/opensfm"
2026-01-07 05:47:17,693 INFO: Starting incremental reconstruction
2026-01-07 05:47:17,766 INFO: Starting reconstruction with image_16.jpg and image_17.jpg
2026-01-07 05:47:17,775 INFO: Two-view 5-points reconstruction inliers (transposed=False): 694 / 747
2026-01-07 05:47:17,824 INFO: Triangulated: 718
2026-01-07 05:47:17,907 DEBUG: Ceres Solver Report: Iterations: 19, Initial cost: 2.197032e+02, Final cost: 1.914838e+02, Termination: CONVERGENCE
2026-01-07 05:47:17,911 INFO: Removed outliers: 18
2026-01-07 05:47:17,915 INFO: -------------------------------------------------------
2026-01-07 05:47:17,917 INFO: image_15.jpg resection inliers: 64 / 133
2026-01-07 05:47:17,918 INFO: Adding image_15.jpg to the reconstruction
2026-01-07 05:47:17,967 DEBUG: Ceres Solver Report: Iterations: 14, Initial cost: 2.808113e+02, Final cost: 2.599280e+02, Termination: CONVERGENCE
2026-01-07 05:47:17,971 INFO: Removed outliers: 20
2026-01-07 05:47:17,971 INFO: -------------------------------------------------------
2026-01-07 05:47:17,973 INFO: image_14.jpg resection inliers: 116 / 149
2026-01-07 05:47:17,974 INFO: Adding image_14.jpg to the reconstruction
2026-01-07 05:47:17,987 INFO: -------------------------------------------------------
2026-01-07 05:47:17,990 INFO: image_13.jpg resection inliers: 129 / 152
2026-01-07 05:47:17,991 INFO: Adding image_13.jpg to the reconstruction
2026-01-07 05:47:18,072 DEBUG: Ceres Solver Report: Iterations: 25, Initial cost: 3.738275e+02, Final cost: 3.180398e+02, Termination: CONVERGENCE
2026-01-07 05:47:18,076 INFO: Removed outliers: 18
2026-01-07 05:47:18,077 INFO: -------------------------------------------------------
2026-01-07 05:47:18,079 INFO: image_3.jpg resection inliers: 146 / 175
2026-01-07 05:47:18,080 INFO: Adding image_3.jpg to the reconstruction
2026-01-07 05:47:18,087 INFO: -------------------------------------------------------
2026-01-07 05:47:18,089 INFO: image_7.jpg resection inliers: 170 / 192
2026-01-07 05:47:18,090 INFO: Adding image_7.jpg to the reconstruction
2026-01-07 05:47:18,097 INFO: -------------------------------------------------------
2026-01-07 05:47:18,099 INFO: image_4.jpg resection inliers: 158 / 199
2026-01-07 05:47:18,100 INFO: Adding image_4.jpg to the reconstruction
2026-01-07 05:47:18,107 INFO: -------------------------------------------------------
2026-01-07 05:47:18,109 INFO: image_1.jpg resection inliers: 156 / 196
2026-01-07 05:47:18,110 INFO: Adding image_1.jpg to the reconstruction
2026-01-07 05:47:18,120 INFO: -------------------------------------------------------
2026-01-07 05:47:18,121 INFO: image_5.jpg resection inliers: 143 / 192
2026-01-07 05:47:18,122 INFO: Adding image_5.jpg to the reconstruction
2026-01-07 05:47:18,133 INFO: -------------------------------------------------------
2026-01-07 05:47:18,135 INFO: image_2.jpg resection inliers: 184 / 216
2026-01-07 05:47:18,136 INFO: Adding image_2.jpg to the reconstruction
2026-01-07 05:47:18,292 DEBUG: Ceres Solver Report: Iterations: 35, Initial cost: 6.626331e+02, Final cost: 5.037812e+02, Termination: CONVERGENCE
2026-01-07 05:47:18,298 INFO: Removed outliers: 29
2026-01-07 05:47:18,299 INFO: -------------------------------------------------------
2026-01-07 05:47:18,301 INFO: image_6.jpg resection inliers: 175 / 218
2026-01-07 05:47:18,302 INFO: Adding image_6.jpg to the reconstruction
2026-01-07 05:47:18,315 INFO: -------------------------------------------------------
2026-01-07 05:47:18,316 INFO: image_8.jpg resection inliers: 153 / 189
2026-01-07 05:47:18,317 INFO: Adding image_8.jpg to the reconstruction
2026-01-07 05:47:18,329 INFO: -------------------------------------------------------
2026-01-07 05:47:18,331 INFO: image_11.jpg resection inliers: 137 / 183
2026-01-07 05:47:18,332 INFO: Adding image_11.jpg to the reconstruction
2026-01-07 05:47:18,343 INFO: -------------------------------------------------------
2026-01-07 05:47:18,346 INFO: image_9.jpg resection inliers: 148 / 189
2026-01-07 05:47:18,347 INFO: Adding image_9.jpg to the reconstruction
2026-01-07 05:47:18,360 INFO: Re-triangulating
2026-01-07 05:47:18,489 DEBUG: Ceres Solver Report: Iterations: 26, Initial cost: 7.345899e+02, Final cost: 6.353522e+02, Termination: CONVERGENCE
2026-01-07 05:47:18,782 DEBUG: Ceres Solver Report: Iterations: 36, Initial cost: 1.234926e+03, Final cost: 8.706188e+02, Termination: CONVERGENCE
2026-01-07 05:47:18,792 INFO: Removed outliers: 54
2026-01-07 05:47:18,793 INFO: -------------------------------------------------------
2026-01-07 05:47:18,795 INFO: image_10.jpg resection inliers: 119 / 151
2026-01-07 05:47:18,795 INFO: Adding image_10.jpg to the reconstruction
2026-01-07 05:47:18,815 INFO: -------------------------------------------------------
2026-01-07 05:47:18,817 INFO: image_12.jpg resection inliers: 136 / 170
2026-01-07 05:47:18,818 INFO: Adding image_12.jpg to the reconstruction
2026-01-07 05:47:18,834 INFO: -------------------------------------------------------
2026-01-07 05:47:19,050 DEBUG: Ceres Solver Report: Iterations: 42, Initial cost: 9.635288e+02, Final cost: 8.681852e+02, Termination: CONVERGENCE
2026-01-07 05:47:19,058 INFO: Removed outliers: 30
2026-01-07 05:47:19,063 INFO: Reconstruction 0: 17 images, 1502 points
2026-01-07 05:47:19,063 INFO: 1 partial reconstructions in total.
[INFO]    Export reconstruction stats
[INFO]    running "/code/SuperBuild/install/bin/opensfm/bin/opensfm" compute_statistics --diagram_max_points 100000 "/var/www/data/bd853eb0-fc89-4fbe-933a-77edcf965e08/opensfm"
2026-01-07 05:47:20,537 DEBUG: Loaded backend agg version v2.2.
2026-01-07 05:47:20,544 DEBUG: locator: <matplotlib.ticker.AutoLocator object at 0xffff500dd730>
2026-01-07 05:47:20,848 DEBUG: locator: <matplotlib.ticker.AutoLocator object at 0xffff501a72f0>
[WARNING] Will skip exporting /var/www/data/bd853eb0-fc89-4fbe-933a-77edcf965e08/opensfm/reconstruction.geocoords.json
[INFO]    Updating /var/www/data/bd853eb0-fc89-4fbe-933a-77edcf965e08/opensfm/config.yaml
[INFO]    undistorted_image_max_size: 1440
[INFO]    Undistorting /var/www/data/bd853eb0-fc89-4fbe-933a-77edcf965e08/opensfm ...
2026-01-07 05:47:22,073 DEBUG: Undistorting image image_6.jpg
2026-01-07 05:47:22,073 DEBUG: Undistorting image image_2.jpg
2026-01-07 05:47:22,074 DEBUG: Undistorting image image_1.jpg
2026-01-07 05:47:22,074 DEBUG: Undistorting image image_17.jpg
2026-01-07 05:47:22,074 DEBUG: Undistorting image image_10.jpg
2026-01-07 05:47:22,074 DEBUG: Undistorting image image_11.jpg
2026-01-07 05:47:22,074 DEBUG: Undistorting image image_15.jpg
2026-01-07 05:47:22,075 DEBUG: Undistorting image image_13.jpg
2026-01-07 05:47:22,076 DEBUG: Undistorting image image_14.jpg
2026-01-07 05:47:22,076 DEBUG: Undistorting image image_3.jpg
2026-01-07 05:47:22,075 DEBUG: Undistorting image image_12.jpg
2026-01-07 05:47:22,207 DEBUG: Undistorting image image_7.jpg
2026-01-07 05:47:22,272 DEBUG: Undistorting image image_5.jpg
2026-01-07 05:47:22,273 DEBUG: Undistorting image image_9.jpg
2026-01-07 05:47:22,353 DEBUG: Undistorting image image_16.jpg
2026-01-07 05:47:22,353 DEBUG: Undistorting image image_4.jpg
2026-01-07 05:47:22,382 DEBUG: Undistorting image image_8.jpg
[INFO]    running "/code/SuperBuild/install/bin/opensfm/bin/opensfm" export_visualsfm --points "/var/www/data/bd853eb0-fc89-4fbe-933a-77edcf965e08/opensfm"
[INFO]    Finished opensfm stage
[INFO]    Running openmvs stage
[INFO]    running "/code/SuperBuild/install/bin/opensfm/bin/opensfm" export_openmvs "/var/www/data/bd853eb0-fc89-4fbe-933a-77edcf965e08/opensfm"
[INFO]    Depthmap resolution set to: 360px
[INFO]    Running dense reconstruction. This might take a while.
[INFO]    Estimating depthmaps
[INFO]    No nvidia-smi detected
[INFO]    running "/code/SuperBuild/install/bin/OpenMVS/DensifyPointCloud" "/var/www/data/bd853eb0-fc89-4fbe-933a-77edcf965e08/opensfm/undistorted/openmvs/scene.mvs" --resolution-level 2 --dense-config-file "/var/www/data/bd853eb0-fc89-4fbe-933a-77edcf965e08/opensfm/undistorted/openmvs/Densify.ini" --max-resolution 1440 --min-resolution 640 --max-threads 11 --number-views-fuse 2 --sub-resolution-levels 2 --archive-type 3 -w "/var/www/data/bd853eb0-fc89-4fbe-933a-77edcf965e08/opensfm/undistorted/openmvs/depthmaps" -v 0 --cuda-device -2
05:47:24 [App     ] OpenMVS x32 v2.2.0
05:47:24 [App     ] Build date: Nov 11 2025, 07:35:21
05:47:24 [App     ] CPU:  (11 cores)
05:47:24 [App     ] RAM: 15.35GB Physical Memory 1024.00MB Virtual Memory
05:47:24 [App     ] OS: Linux 6.12.54-linuxkit (aarch64)
05:47:24 [App     ] Disk:
05:47:24 [App     ] warning: no SSE compatible CPU or OS detected
05:47:24 [App     ] Command line: DensifyPointCloud /var/www/data/bd853eb0-fc89-4fbe-933a-77edcf965e08/opensfm/undistorted/openmvs/scene.mvs --resolution-level 2 --dense-config-file /var/www/data/bd853eb0-fc89-4fbe-933a-77edcf965e08/opensfm/undistorted/openmvs/Densify.ini --max-resolution 1440 --min-resolution 640 --max-threads 11 --number-views-fuse 2 --sub-resolution-levels 2 --archive-type 3 -w /var/www/data/bd853eb0-fc89-4fbe-933a-77edcf965e08/opensfm/undistorted/openmvs/depthmaps -v 0 --cuda-device -2
05:47:24 [App     ] The camera directions mean is unbalanced; the scene will be considered unbounded (no ROI)
05:47:24 [App     ] Preparing images for dense reconstruction completed: 17 images (33ms)
05:47:24 [App     ] Selecting images for dense reconstruction completed: 17 images (0ms)

Estimated depth-maps 1 (5.88%, 1s, ETA 24s)...
Estimated depth-maps 2 (11.76%, 2s, ETA 15s)...
Estimated depth-maps 3 (17.65%, 3s, ETA 16s)...
Estimated depth-maps 4 (23.53%, 5s, ETA 16s)...
Estimated depth-maps 5 (29.41%, 6s, ETA 15s)...
Estimated depth-maps 6 (35.29%, 8s, ETA 14s)...
Estimated depth-maps 7 (41.18%, 9s, ETA 13s)...
Estimated depth-maps 8 (47.06%, 10s, ETA 12s)...
Estimated depth-maps 9 (52.94%, 12s, ETA 11s)...
Estimated depth-maps 10 (58.82%, 14s, ETA 9s)...
Estimated depth-maps 11 (64.71%, 15s, ETA 8s)...
Estimated depth-maps 12 (70.59%, 16s, ETA 7s)...
Estimated depth-maps 13 (76.47%, 18s, ETA 5s)...
Estimated depth-maps 14 (82.35%, 19s, ETA 4s)...
Estimated depth-maps 15 (88.24%, 21s, ETA 2s)...
Estimated depth-maps 16 (94.12%, 23s, ETA 1s)...
Estimated depth-maps 17 (100.00%, 24s, ETA 0ms)...
Estimated depth-maps 17 (100%, 24s947ms)

Geometric-consistent estimated depth-maps 1 (5.88%, 338ms, ETA 5s)...
Geometric-consistent estimated depth-maps 2 (11.76%, 465ms, ETA 3s)...
Geometric-consistent estimated depth-maps 3 (17.65%, 761ms, ETA 3s)...
Geometric-consistent estimated depth-maps 4 (23.53%, 1s, ETA 3s)...
Geometric-consistent estimated depth-maps 5 (29.41%, 1s, ETA 3s)...
Geometric-consistent estimated depth-maps 6 (35.29%, 1s, ETA 3s)...
Geometric-consistent estimated depth-maps 7 (41.18%, 2s, ETA 2s)...
Geometric-consistent estimated depth-maps 8 (47.06%, 2s, ETA 2s)...
Geometric-consistent estimated depth-maps 9 (52.94%, 2s, ETA 2s)...
Geometric-consistent estimated depth-maps 10 (58.82%, 2s, ETA 2s)...
Geometric-consistent estimated depth-maps 11 (64.71%, 3s, ETA 1s)...
Geometric-consistent estimated depth-maps 12 (70.59%, 3s, ETA 1s)...
Geometric-consistent estimated depth-maps 13 (76.47%, 3s, ETA 1s)...
Geometric-consistent estimated depth-maps 14 (82.35%, 4s, ETA 900ms)...
Geometric-consistent estimated depth-maps 15 (88.24%, 4s, ETA 598ms)...
Geometric-consistent estimated depth-maps 16 (94.12%, 4s, ETA 300ms)...
Geometric-consistent estimated depth-maps 17 (100.00%, 5s, ETA 0ms)...
Geometric-consistent estimated depth-maps 17 (100%, 5s115ms)

Geometric-consistent estimated depth-maps 1 (5.88%, 322ms, ETA 5s)...
Geometric-consistent estimated depth-maps 2 (11.76%, 510ms, ETA 3s)...
Geometric-consistent estimated depth-maps 3 (17.65%, 768ms, ETA 3s)...
Geometric-consistent estimated depth-maps 4 (23.53%, 1s, ETA 3s)...
Geometric-consistent estimated depth-maps 5 (29.41%, 1s, ETA 3s)...
Geometric-consistent estimated depth-maps 6 (35.29%, 1s, ETA 3s)...
Geometric-consistent estimated depth-maps 7 (41.18%, 1s, ETA 2s)...
Geometric-consistent estimated depth-maps 8 (47.06%, 2s, ETA 2s)...
Geometric-consistent estimated depth-maps 9 (52.94%, 2s, ETA 2s)...
Geometric-consistent estimated depth-maps 10 (58.82%, 3s, ETA 2s)...
Geometric-consistent estimated depth-maps 11 (64.71%, 3s, ETA 1s)...
Geometric-consistent estimated depth-maps 12 (70.59%, 3s, ETA 1s)...
Geometric-consistent estimated depth-maps 13 (76.47%, 3s, ETA 1s)...
Geometric-consistent estimated depth-maps 14 (82.35%, 4s, ETA 899ms)...
Geometric-consistent estimated depth-maps 15 (88.24%, 4s, ETA 599ms)...
Geometric-consistent estimated depth-maps 16 (94.12%, 4s, ETA 301ms)...
Geometric-consistent estimated depth-maps 17 (100.00%, 5s, ETA 0ms)...
Geometric-consistent estimated depth-maps 17 (100%, 5s107ms)

Filtered depth-maps 1 (5.88%, 168ms, ETA 2s)...
Filtered depth-maps 17 (100%, 225ms)

Fused depth-maps 5 (29.41%, 100ms, ETA 241ms)...
Fused depth-maps 17 (100%, 186ms)
05:48:00 [App     ] Densifying point-cloud completed: 156330 points (35s686ms)
[INFO]    running "/code/SuperBuild/install/bin/OpenMVS/DensifyPointCloud" --filter-point-cloud -20 -i "/var/www/data/bd853eb0-fc89-4fbe-933a-77edcf965e08/opensfm/undistorted/openmvs/scene_dense.mvs" -v 0 --cuda-device -2
05:48:00 [App     ] OpenMVS x32 v2.2.0
05:48:00 [App     ] Build date: Nov 11 2025, 07:35:21
05:48:00 [App     ] CPU:  (11 cores)
05:48:00 [App     ] RAM: 15.35GB Physical Memory 1024.00MB Virtual Memory
05:48:00 [App     ] OS: Linux 6.12.54-linuxkit (aarch64)
05:48:00 [App     ] Disk:
05:48:00 [App     ] warning: no SSE compatible CPU or OS detected
05:48:00 [App     ] Command line: DensifyPointCloud --filter-point-cloud -20 -i /var/www/data/bd853eb0-fc89-4fbe-933a-77edcf965e08/opensfm/undistorted/openmvs/scene_dense.mvs -v 0 --cuda-device -2
05:48:00 [App     ] The camera directions mean is unbalanced; the scene will be considered unbounded (no ROI)

Point visibility checks 32926 (21.06%, 100ms, ETA 374ms)...
Point visibility checks 67181 (42.97%, 200ms, ETA 265ms)...
Point visibility checks 98744 (63.16%, 300ms, ETA 174ms)...
Point visibility checks 122016 (78.05%, 400ms, ETA 112ms)...
Point visibility checks 137142 (87.73%, 500ms, ETA 69ms)...
Point visibility checks 152457 (97.52%, 600ms, ETA 15ms)...
Point visibility checks 156330 (100%, 646ms)
[INFO]    Finished openmvs stage
[INFO]    Running odm_filterpoints stage
[INFO]    Filtering /var/www/data/bd853eb0-fc89-4fbe-933a-77edcf965e08/opensfm/undistorted/openmvs/scene_dense_dense_filtered.ply (statistical, meanK 16, standard deviation 5)
[INFO]    running "/code/SuperBuild/install/bin/FPCFilter" --input "/var/www/data/bd853eb0-fc89-4fbe-933a-77edcf965e08/opensfm/undistorted/openmvs/scene_dense_dense_filtered.ply" --output "/var/www/data/bd853eb0-fc89-4fbe-933a-77edcf965e08/odm_filterpoints/point_cloud.ply" --concurrency 11 --meank 16 --std 5 --stats "/var/www/data/bd853eb0-fc89-4fbe-933a-77edcf965e08/odm_filterpoints/point_cloud_stats.json"
*** FPCFilter - v0.2 ***

?> Parameters:
input = /var/www/data/bd853eb0-fc89-4fbe-933a-77edcf965e08/opensfm/undistorted/openmvs/scene_dense_dense_filtered.ply
output = /var/www/data/bd853eb0-fc89-4fbe-933a-77edcf965e08/odm_filterpoints/point_cloud.ply
stats = /var/www/data/bd853eb0-fc89-4fbe-933a-77edcf965e08/odm_filterpoints/point_cloud_stats.json
std = 5
meanK = 16
boundary = auto
concurrency = 11
verbose = no

-> Setting num_threads to 11

?> Skipping crop

?> Skipping sampling

-> Statistical filtering

-> Spacing estimation completed (0.01 meters)

?> Done in 0.08358s

-> Writing output

?> Done in 0.01335s

?> Pipeline done in 0.09697s

[INFO]    Finished odm_filterpoints stage
[INFO]    Running odm_meshing stage
[INFO]    Writing ODM Mesh file in: /var/www/data/bd853eb0-fc89-4fbe-933a-77edcf965e08/odm_meshing/odm_mesh.ply
[INFO]    running "/code/SuperBuild/install/bin/PoissonRecon" --in "/var/www/data/bd853eb0-fc89-4fbe-933a-77edcf965e08/odm_filterpoints/point_cloud.ply" --out "/var/www/data/bd853eb0-fc89-4fbe-933a-77edcf965e08/odm_meshing/odm_mesh.dirty.ply" --depth 11 --pointWeight 4.0 --samplesPerNode 1.0 --threads 10 --bType 2 --linearFit
[INFO]    running "/code/SuperBuild/install/bin/OpenMVS/ReconstructMesh" -i "/var/www/data/bd853eb0-fc89-4fbe-933a-77edcf965e08/odm_meshing/odm_mesh.dirty.ply" -o "/var/www/data/bd853eb0-fc89-4fbe-933a-77edcf965e08/odm_meshing/odm_mesh.ply" --archive-type 3 --remove-spikes 0 --remove-spurious 20 --smooth 0 --target-face-num 400000 -v 0
05:48:10 [App     ] OpenMVS x32 v2.2.0
05:48:10 [App     ] Build date: Nov 11 2025, 07:35:21
05:48:10 [App     ] CPU:  (11 cores)
05:48:10 [App     ] RAM: 15.35GB Physical Memory 1024.00MB Virtual Memory
05:48:10 [App     ] OS: Linux 6.12.54-linuxkit (aarch64)
05:48:10 [App     ] Disk:
05:48:10 [App     ] warning: no SSE compatible CPU or OS detected
05:48:10 [App     ] Command line: ReconstructMesh -i /var/www/data/bd853eb0-fc89-4fbe-933a-77edcf965e08/odm_meshing/odm_mesh.dirty.ply -o /var/www/data/bd853eb0-fc89-4fbe-933a-77edcf965e08/odm_meshing/odm_mesh.ply --archive-type 3 --remove-spikes 0 --remove-spurious 20 --smooth 0 --target-face-num 400000 -v 0

Decimated faces 37792 (3.68%, 762ms, ETA 19s)...
Decimated faces 77216 (7.51%, 862ms, ETA 10s)...
Decimated faces 116102 (11.29%, 962ms, ETA 7s)...
Decimated faces 148414 (14.44%, 1s, ETA 6s)...
Decimated faces 179510 (17.46%, 1s, ETA 5s)...
Decimated faces 206156 (20.06%, 1s, ETA 5s)...
Decimated faces 231104 (22.48%, 1s, ETA 4s)...
Decimated faces 252480 (24.56%, 1s, ETA 4s)...
Decimated faces 267091 (25.98%, 1s, ETA 4s)...
Decimated faces 280209 (27.26%, 1s, ETA 4s)...
Decimated faces 291893 (28.40%, 1s, ETA 4s)...
Decimated faces 315821 (30.72%, 1s, ETA 4s)...
Decimated faces 339315 (33.01%, 1s, ETA 3s)...
Decimated faces 360575 (35.08%, 2s, ETA 3s)...
Decimated faces 380499 (37.02%, 2s, ETA 3s)...
Decimated faces 400078 (38.92%, 2s, ETA 3s)...
Decimated faces 418964 (40.76%, 2s, ETA 3s)...
Decimated faces 433711 (42.19%, 2s, ETA 3s)...
Decimated faces 463525 (45.09%, 2s, ETA 3s)...
Decimated faces 492804 (47.94%, 2s, ETA 3s)...
Decimated faces 515116 (50.11%, 3s, ETA 3s)...
Decimated faces 530260 (51.59%, 3s, ETA 2s)...
Decimated faces 554772 (53.97%, 3s, ETA 2s)...
Decimated faces 578960 (56.32%, 3s, ETA 2s)...
Decimated faces 602496 (58.61%, 3s, ETA 2s)...
Decimated faces 624661 (60.77%, 3s, ETA 2s)...
Decimated faces 646747 (62.92%, 3s, ETA 2s)...
Decimated faces 667506 (64.94%, 3s, ETA 2s)...
Decimated faces 687836 (66.92%, 3s, ETA 1s)...
Decimated faces 707604 (68.84%, 3s, ETA 1s)...
Decimated faces 726374 (70.66%, 4s, ETA 1s)...
Decimated faces 743572 (72.34%, 4s, ETA 1s)...
Decimated faces 761004 (74.03%, 4s, ETA 1s)...
Decimated faces 777926 (75.68%, 4s, ETA 1s)...
Decimated faces 793814 (77.23%, 4s, ETA 1s)...
Decimated faces 808272 (78.63%, 4s, ETA 1s)...
Decimated faces 822648 (80.03%, 4s, ETA 1s)...
Decimated faces 832226 (80.96%, 4s, ETA 1s)...
Decimated faces 857322 (83.40%, 4s, ETA 988ms)...
Decimated faces 881408 (85.75%, 5s, ETA 842ms)...
Decimated faces 904970 (88.04%, 5s, ETA 702ms)...
Decimated faces 927248 (90.21%, 5s, ETA 572ms)...
Decimated faces 948590 (92.28%, 5s, ETA 449ms)...
Decimated faces 968370 (94.21%, 5s, ETA 336ms)...
Decimated faces 985501 (95.87%, 5s, ETA 239ms)...
Decimated faces 1003313 (97.61%, 5s, ETA 139ms)...
Decimated faces 1019831 (99.21%, 5s, ETA 45ms)...
Decimated faces 1027917 (100%, 5s817ms)
[INFO]    Writing ODM 2.5D Mesh file in: /var/www/data/bd853eb0-fc89-4fbe-933a-77edcf965e08/odm_meshing/odm_25dmesh.ply
[INFO]    ODM 2.5D DSM resolution: 0.01
[INFO]    Created temporary directory: /var/www/data/bd853eb0-fc89-4fbe-933a-77edcf965e08/odm_meshing/tmp
[INFO]    Creating DSM for 2.5D mesh
[INFO]    running renderdem "/var/www/data/bd853eb0-fc89-4fbe-933a-77edcf965e08/odm_filterpoints/point_cloud.ply" --outdir "/var/www/data/bd853eb0-fc89-4fbe-933a-77edcf965e08/odm_meshing/tmp" --output-type max --radiuses 0.015707963267948967,0.022214414690791835,0.03141592653589794 --resolution 0.01 --max-tiles 9 --decimation 1 --classification -1 --tile-size 4096 --force
Reading 152619 points
Point cloud bounds are [minx: -4.58140659332, maxx: 2.57312011719, miny: -3.56445741653, maxy: 5.36067247391]
DEM resolution is (716, 893), max tile size is 4096, will split DEM generation into 1 tiles
r0.015708_x0_y0.tif
r0.0222144_x0_y0.tif
r0.0314159_x0_y0.tif
[INFO]    Generated 3 tiles
[INFO]    running gdalbuildvrt -input_file_list "/var/www/data/bd853eb0-fc89-4fbe-933a-77edcf965e08/odm_meshing/tmp/tiles_list.txt" "/var/www/data/bd853eb0-fc89-4fbe-933a-77edcf965e08/odm_meshing/tmp/tiles.vrt"
0...10...20...30...40...50...60...70...80...90...100 - done.
[INFO]    running gdal_translate -co NUM_THREADS=11 -co BIGTIFF=IF_SAFER -co COMPRESS=DEFLATE --config GDAL_CACHEMAX 46.4% -outsize 10% 0 "/var/www/data/bd853eb0-fc89-4fbe-933a-77edcf965e08/odm_meshing/tmp/tiles.vrt" "/var/www/data/bd853eb0-fc89-4fbe-933a-77edcf965e08/odm_meshing/tmp/tiles.small.tif"
0
...10..
.20...30
...40
..
.
50
.
.
.
60
.
.
.70
.
..80
.
.
.
90
.
..
Input file size is 716, 893
0...10...20...30...40...50...60...70...80...90...100 - done.
[INFO]    running gdalbuildvrt -resolution highest -r bilinear "/var/www/data/bd853eb0-fc89-4fbe-933a-77edcf965e08/odm_meshing/tmp/merged.vrt" "/var/www/data/bd853eb0-fc89-4fbe-933a-77edcf965e08/odm_meshing/tmp/tiles.small_filled.tif" "/var/www/data/bd853eb0-fc89-4fbe-933a-77edcf965e08/odm_meshing/tmp/tiles.vrt"
0...10...20...30...40...50...60...70...80...90...100 - done.
[INFO]    running gdal_translate -co NUM_THREADS=11 -co TILED=YES -co BIGTIFF=IF_SAFER -co COMPRESS=DEFLATE --config GDAL_CACHEMAX 46.4% "/var/www/data/bd853eb0-fc89-4fbe-933a-77edcf965e08/odm_meshing/tmp/merged.vrt" "/var/www/data/bd853eb0-fc89-4fbe-933a-77edcf965e08/odm_meshing/tmp/tiles.tif"
Input file size is 716, 893
0...10...20...30...40...50...60...70...80...90...100 - done.
[INFO]    running fastrasterfilter "/var/www/data/bd853eb0-fc89-4fbe-933a-77edcf965e08/odm_meshing/tmp/tiles.tif" --output "/var/www/data/bd853eb0-fc89-4fbe-933a-77edcf965e08/odm_meshing/tmp/mesh_dsm.tif" --window-size 512 --radius 4 --co TILED=YES --co BIGTIFF=IF_SAFER --co COMPRESS=DEFLATE
Input: /var/www/data/bd853eb0-fc89-4fbe-933a-77edcf965e08/odm_meshing/tmp/tiles.tif
Size: 716x893
Blocks: 1
Smoothing...1... done
Wrote /var/www/data/bd853eb0-fc89-4fbe-933a-77edcf965e08/odm_meshing/tmp/mesh_dsm.tif
[INFO]    Completed smoothing to create /var/www/data/bd853eb0-fc89-4fbe-933a-77edcf965e08/odm_meshing/tmp/mesh_dsm.tif in 0:00:00.112634
[INFO]    Completed mesh_dsm.tif in 0:00:00.318923
[INFO]    Creating mesh from DSM: /var/www/data/bd853eb0-fc89-4fbe-933a-77edcf965e08/odm_meshing/tmp/mesh_dsm.tif
[INFO]    running "/code/SuperBuild/install/bin/dem2mesh" -inputFile "/var/www/data/bd853eb0-fc89-4fbe-933a-77edcf965e08/odm_meshing/tmp/mesh_dsm.tif" -outputFile "/var/www/data/bd853eb0-fc89-4fbe-933a-77edcf965e08/odm_meshing/odm_25dmesh.dirty.ply" -maxTileLength 2000 -maxVertexCount 200000 -maxConcurrency 11 -edgeSwapThreshold 0.15 -verbose
Running with parameters:
-inputFile /var/www/data/bd853eb0-fc89-4fbe-933a-77edcf965e08/odm_meshing/tmp/mesh_dsm.tif
-outputFile /var/www/data/bd853eb0-fc89-4fbe-933a-77edcf965e08/odm_meshing/odm_25dmesh.dirty.ply
-maxVertexCount 200000
-maxTileLength 2000
-maxConcurrency 11
-edgeSwapThreshold 0.150000
-verbose
Raster Size is 716x893
Extent is (-4.581407, 2.578593), (-3.564457, 5.365543)
NoData value: -9999
Description:
Reading raster...
Total vertices before simplification: 639388
Subdivisions: 1x1
Splitting area in 1
Block size is 716, 893
Concurrency set to 11
Allocating 1 raster data blocks of 2868 bytes
Scanning block (0,0)
Empty blocks: 0
Processing block (0,0)
Sampled 1275560 faces, target is 400000
Triangle count: 400000
Single block, saving to PLY
Performing edge collapses...
Writing to file...  done!
[INFO]    running "/code/SuperBuild/install/bin/OpenMVS/ReconstructMesh" -i "/var/www/data/bd853eb0-fc89-4fbe-933a-77edcf965e08/odm_meshing/odm_25dmesh.dirty.ply" -o "/var/www/data/bd853eb0-fc89-4fbe-933a-77edcf965e08/odm_meshing/odm_25dmesh.ply" --archive-type 3 --remove-spikes 0 --remove-spurious 0 --smooth 0 --target-face-num 400000 -v 0
05:48:21 [App     ] OpenMVS x32 v2.2.0
05:48:21 [App     ] Build date: Nov 11 2025, 07:35:21
05:48:21 [App     ] CPU:  (11 cores)
05:48:21 [App     ] RAM: 15.35GB Physical Memory 1024.00MB Virtual Memory
05:48:21 [App     ] OS: Linux 6.12.54-linuxkit (aarch64)
05:48:21 [App     ] Disk:
05:48:21 [App     ] warning: no SSE compatible CPU or OS detected
05:48:21 [App     ] Command line: ReconstructMesh -i /var/www/data/bd853eb0-fc89-4fbe-933a-77edcf965e08/odm_meshing/odm_25dmesh.dirty.ply -o /var/www/data/bd853eb0-fc89-4fbe-933a-77edcf965e08/odm_meshing/odm_25dmesh.ply --archive-type 3 --remove-spikes 0 --remove-spurious 0 --smooth 0 --target-face-num 400000 -v 0
[INFO]    Finished odm_meshing stage
[INFO]    Running mvs_texturing stage
[INFO]    Writing MVS Textured file in: /var/www/data/bd853eb0-fc89-4fbe-933a-77edcf965e08/odm_texturing/odm_textured_model_geo.obj
[INFO]    running "/code/SuperBuild/install/bin/texrecon" "/var/www/data/bd853eb0-fc89-4fbe-933a-77edcf965e08/opensfm/undistorted/reconstruction.nvm" "/var/www/data/bd853eb0-fc89-4fbe-933a-77edcf965e08/odm_meshing/odm_mesh.ply" "/var/www/data/bd853eb0-fc89-4fbe-933a-77edcf965e08/odm_texturing/odm_textured_model_geo" -d gmi -o gauss_clamping -t none --no_intermediate_results     --num_threads=11 --max_texture_size=8192
/code/SuperBuild/install/bin/texrecon (built on Nov 11 2025, 06:01:09)
Load and prepare mesh:
Reading PLY: 161605 verts... 323633 faces... done.
Generating texture views:
NVM: Loading file...
NVM: Number of views: 17
NVM: Number of features: 1502


Loading 100%... done. (Took 0.032s)
Building adjacency graph:


Adding edges 100%... done. (Took 0.261s)
485393 total edges.
View selection:
Building BVH from 323633 faces... done. (Took: 212 ms)


Calculating face qualities 100%... done. (Took 1.461s)


Postprocessing face infos 100%... done. (Took 0.112s)
Maximum quality of a face within an image: 72.4386
Clamping qualities to 6.60706 within normalization.
Optimizing:
Time[s]	Energy
0	334839
2	329138
3	324229
3	321665
3	320600
3	320029
3	319709
4	319354
4	319174
5	319035
5	318932
5	318879
5	318826
5	318773
140760 faces have not been seen
Took: 7.709s
Generating texture patches:
Running... done. (Took 0.251s)
6996 texture patches.
Running global seam leveling:
Create matrices for optimization...  done.
Lhs dimensionality: 131676 x 131676
Calculating adjustments:
Color channel 0: CG took 111 iterations. Residual is 9.9256e-05
Color channel 1: CG took 112 iterations. Residual is 9.85154e-05
Color channel 2: CG took 117 iterations. Residual is 8.7071e-05
Took 0.113 seconds


Adjusting texture patches 100%... done. (Took 0.02s)
Running local seam leveling:


Blending texture patches 100%... done. (Took 0.423s)
Generating texture atlases:
Sorting texture patches... done.

Working on atlas 22 100%... done.
Finalizing texture atlases... done. (Took: 0s)
Building objmodel:
Saving model... done.
Whole texturing procedure took: 11.31s
[INFO]    Generating glTF Binary
[INFO]    Converting /var/www/data/bd853eb0-fc89-4fbe-933a-77edcf965e08/odm_texturing/odm_textured_model_geo.obj --> /var/www/data/bd853eb0-fc89-4fbe-933a-77edcf965e08/odm_texturing/odm_textured_model_geo.glb
[INFO]    Loading /var/www/data/bd853eb0-fc89-4fbe-933a-77edcf965e08/odm_texturing/odm_textured_model_geo.obj
[INFO]    Loading odm_textured_model_geo_material0000_map_Kd.png
[INFO]    Loading odm_textured_model_geo_material0001_map_Kd.png
[INFO]    Loading odm_textured_model_geo_material0002_map_Kd.png
[INFO]    Loading odm_textured_model_geo_material0003_map_Kd.png
[INFO]    Loading odm_textured_model_geo_material0004_map_Kd.png
[INFO]    Loading odm_textured_model_geo_material0005_map_Kd.png
[INFO]    Loading odm_textured_model_geo_material0006_map_Kd.png
[INFO]    Loading odm_textured_model_geo_material0007_map_Kd.png
[INFO]    Loading odm_textured_model_geo_material0008_map_Kd.png
[INFO]    Loading odm_textured_model_geo_material0009_map_Kd.png
[INFO]    Loading odm_textured_model_geo_material0010_map_Kd.png
[INFO]    Loading odm_textured_model_geo_material0011_map_Kd.png
[INFO]    Loading odm_textured_model_geo_material0012_map_Kd.png
[INFO]    Loading odm_textured_model_geo_material0013_map_Kd.png
[INFO]    Loading odm_textured_model_geo_material0014_map_Kd.png
[INFO]    Loading odm_textured_model_geo_material0015_map_Kd.png
[INFO]    Loading odm_textured_model_geo_material0016_map_Kd.png
[INFO]    Loading odm_textured_model_geo_material0017_map_Kd.png
[INFO]    Loading odm_textured_model_geo_material0018_map_Kd.png
[INFO]    Loading odm_textured_model_geo_material0019_map_Kd.png
[INFO]    Loading odm_textured_model_geo_material0020_map_Kd.png
[INFO]    Loading odm_textured_model_geo_material0021_map_Kd.png
2026-01-07 05:48:34,725 WARNING: CPLE_NotSupported in driver JPEG does not support creation option JPEG_QUALITY
2026-01-07 05:48:34,745 WARNING: CPLE_NotSupported in driver JPEG does not support creation option JPEG_QUALITY
2026-01-07 05:48:34,747 WARNING: CPLE_NotSupported in driver JPEG does not support creation option JPEG_QUALITY
2026-01-07 05:48:34,749 WARNING: CPLE_NotSupported in driver JPEG does not support creation option JPEG_QUALITY
2026-01-07 05:48:34,751 WARNING: CPLE_NotSupported in driver JPEG does not support creation option JPEG_QUALITY
2026-01-07 05:48:34,754 WARNING: CPLE_NotSupported in driver JPEG does not support creation option JPEG_QUALITY
2026-01-07 05:48:34,756 WARNING: CPLE_NotSupported in driver JPEG does not support creation option JPEG_QUALITY
2026-01-07 05:48:34,758 WARNING: CPLE_NotSupported in driver JPEG does not support creation option JPEG_QUALITY
2026-01-07 05:48:34,759 WARNING: CPLE_NotSupported in driver JPEG does not support creation option JPEG_QUALITY
2026-01-07 05:48:34,760 WARNING: CPLE_NotSupported in driver JPEG does not support creation option JPEG_QUALITY
2026-01-07 05:48:34,761 WARNING: CPLE_NotSupported in driver JPEG does not support creation option JPEG_QUALITY
2026-01-07 05:48:34,762 WARNING: CPLE_NotSupported in driver JPEG does not support creation option JPEG_QUALITY
2026-01-07 05:48:34,763 WARNING: CPLE_NotSupported in driver JPEG does not support creation option JPEG_QUALITY
2026-01-07 05:48:34,764 WARNING: CPLE_NotSupported in driver JPEG does not support creation option JPEG_QUALITY
2026-01-07 05:48:34,765 WARNING: CPLE_NotSupported in driver JPEG does not support creation option JPEG_QUALITY
2026-01-07 05:48:34,766 WARNING: CPLE_NotSupported in driver JPEG does not support creation option JPEG_QUALITY
2026-01-07 05:48:34,767 WARNING: CPLE_NotSupported in driver JPEG does not support creation option JPEG_QUALITY
2026-01-07 05:48:34,768 WARNING: CPLE_NotSupported in driver JPEG does not support creation option JPEG_QUALITY
2026-01-07 05:48:34,769 WARNING: CPLE_NotSupported in driver JPEG does not support creation option JPEG_QUALITY
2026-01-07 05:48:34,770 WARNING: CPLE_NotSupported in driver JPEG does not support creation option JPEG_QUALITY
2026-01-07 05:48:34,771 WARNING: CPLE_NotSupported in driver JPEG does not support creation option JPEG_QUALITY
2026-01-07 05:48:34,772 WARNING: CPLE_NotSupported in driver JPEG does not support creation option JPEG_QUALITY
[INFO]    Writing...
[INFO]    Wrote /var/www/data/bd853eb0-fc89-4fbe-933a-77edcf965e08/odm_texturing/odm_textured_model_geo.glb
[INFO]    Compressing with draco
[INFO]    running draco_transcoder -i "/var/www/data/bd853eb0-fc89-4fbe-933a-77edcf965e08/odm_texturing/odm_textured_model_geo.glb" -o "/var/www/data/bd853eb0-fc89-4fbe-933a-77edcf965e08/odm_texturing/odm_textured_model_geo_compressed.glb" -qt 16 -qp 16
Transcode	/var/www/data/bd853eb0-fc89-4fbe-933a-77edcf965e08/odm_texturing/odm_textured_model_geo.glb	272
[INFO]    Writing MVS Textured file in: /var/www/data/bd853eb0-fc89-4fbe-933a-77edcf965e08/odm_texturing_25d/odm_textured_model_geo.obj
[INFO]    running "/code/SuperBuild/install/bin/texrecon" "/var/www/data/bd853eb0-fc89-4fbe-933a-77edcf965e08/opensfm/undistorted/reconstruction.nvm" "/var/www/data/bd853eb0-fc89-4fbe-933a-77edcf965e08/odm_meshing/odm_25dmesh.ply" "/var/www/data/bd853eb0-fc89-4fbe-933a-77edcf965e08/odm_texturing_25d/odm_textured_model_geo" -d gmi -o gauss_clamping -t none --no_intermediate_results   --nadir_mode  --num_threads=11 --max_texture_size=8192
/code/SuperBuild/install/bin/texrecon (built on Nov 11 2025, 06:01:09)
Load and prepare mesh:
Reading PLY: 199293 verts... 395372 faces... done.
Generating texture views:
NVM: Loading file...
NVM: Number of views: 17
NVM: Number of features: 1502


Loading 100%... done. (Took 0.033s)
Building adjacency graph:


Adding edges 100%... done. (Took 0.281s)
591452 total edges.
View selection:
Building BVH from 395372 faces... done. (Took: 192 ms)


Calculating face qualities 100%... done. (Took 1.272s)


Postprocessing face infos 100%... done. (Took 0.247s)
Maximum quality of a face within an image: 9999.98
Clamping qualities to 9938.98 within normalization.
Optimizing:
Time[s]	Energy
0	183133
0	180703
1	178141
1	176894
1	176315
1	175942
1	175730
2	175625
2	175470
2	175389
2	175328
3	175276
3	175229
3	175186
38632 faces have not been seen
Took: 5.713s
Generating texture patches:
Running... done. (Took 0.268s)
249 texture patches.
Running global seam leveling:
Create matrices for optimization...  done.
Lhs dimensionality: 186846 x 186846
Calculating adjustments:
Color channel 0: CG took 81 iterations. Residual is 8.57847e-05
Color channel 2: CG took 81 iterations. Residual is 8.37665e-05
Color channel 1: CG took 80 iterations. Residual is 9.77306e-05
Took 0.103 seconds


Adjusting texture patches 100%... done. (Took 0.055s)
Running local seam leveling:


Blending texture patches 100%... done. (Took 0.777s)
Generating texture atlases:
Sorting texture patches... done.

Working on atlas 1 100%... done.
Finalizing texture atlases... done. (Took: 0s)
Building objmodel:
Saving model... done.
Whole texturing procedure took: 9.655s
[INFO]    Finished mvs_texturing stage
[INFO]    Running odm_georeferencing stage
[INFO]    Converting point cloud (non-georeferenced)
[INFO]    running pdal translate -i "/var/www/data/bd853eb0-fc89-4fbe-933a-77edcf965e08/odm_filterpoints/point_cloud.ply" -o "/var/www/data/bd853eb0-fc89-4fbe-933a-77edcf965e08/odm_georeferencing/odm_georeferenced_model.laz" ferry --filters.ferry.dimensions="views => UserData"
[INFO]    Creating Entwine Point Tile output
[INFO]    running entwine build --threads 11 --tmp "/var/www/data/bd853eb0-fc89-4fbe-933a-77edcf965e08/entwine_pointcloud-tmp" -i /var/www/data/bd853eb0-fc89-4fbe-933a-77edcf965e08/odm_georeferencing/odm_georeferenced_model.laz -o "/var/www/data/bd853eb0-fc89-4fbe-933a-77edcf965e08/entwine_pointcloud"
1/1: /var/www/data/bd853eb0-fc89-4fbe-933a-77edcf965e08/odm_georeferencing/odm_georeferenced_model.laz
Dimensions: [
X:int32, Y:int32, Z:int32, Intensity:uint16, ReturnNumber:uint8,
NumberOfReturns:uint8, ScanDirectionFlag:uint8, EdgeOfFlightLine:uint8,
Classification:uint8, Synthetic:uint8, KeyPoint:uint8, Withheld:uint8,
Overlap:uint8, ScanAngleRank:float32, UserData:uint8, PointSourceId:uint16,
GpsTime:float64, ScanChannel:uint8, Red:uint16, Green:uint16, Blue:uint16,
OriginId:uint32
]
Points: 152,619
Bounds: [(-5, -4, -12), (3, 6, 0)]
Scale: 0.01
SRS: none

Adding 0 - /var/www/data/bd853eb0-fc89-4fbe-933a-77edcf965e08/odm_georeferencing/odm_georeferenced_model.laz
Joining
Done 0
Saving
Wrote 152,619 points.
[INFO]    Finished odm_georeferencing stage
[INFO]    Running odm_dem stage
[WARNING] Not georeferenced, using ungeoreferenced point cloud...
[WARNING] Cannot calculate GSD, using requested resolution of 5.00
[INFO]    Create DSM: False
[INFO]    Create DTM: False
[INFO]    DEM input file /var/www/data/bd853eb0-fc89-4fbe-933a-77edcf965e08/odm_georeferencing/odm_georeferenced_model.laz found: True
[WARNING] DEM will not be generated
[INFO]    Finished odm_dem stage
[INFO]    Running odm_orthophoto stage
[WARNING] Cannot calculate GSD, using requested resolution of 5.00
[INFO]    Creating GeoTIFF
[INFO]    running "/code/SuperBuild/install/bin/odm_orthophoto" -inputFiles /var/www/data/bd853eb0-fc89-4fbe-933a-77edcf965e08/odm_texturing_25d/odm_textured_model_geo.obj -logFile "/var/www/data/bd853eb0-fc89-4fbe-933a-77edcf965e08/odm_orthophoto/odm_orthophoto_log.txt" -outputFile "/var/www/data/bd853eb0-fc89-4fbe-933a-77edcf965e08/odm_orthophoto/odm_orthophoto_render.tif" -resolution 20.0 -verbose -outputCornerFile "/var/www/data/bd853eb0-fc89-4fbe-933a-77edcf965e08/odm_orthophoto/odm_orthophoto_corners.txt"       --config GDAL_CACHEMAX 7495940096.0
Reading mesh file... /var/www/data/bd853eb0-fc89-4fbe-933a-77edcf965e08/odm_texturing_25d/odm_textured_model_geo.obj
Found material0000
Loading odm_textured_model_geo_material0000_map_Kd.png
Mesh file read.

Boundary points:
Point 1: -4.58141 -3.55446
Point 2: -4.58141 5.36554
Point 3: 2.56859 5.36554
Point 4: 2.56859 -3.55446

Model bounds x : -4.58141 -> 2.56859
Model bounds y : -3.55446 -> 5.36554
Model area : 63.778m2
Model resolution, width x height : 144x179
Translating and scaling mesh...
Rendering the ortho photo...
Texture channels: 3
Texture depth: 8bit
Rendering material0000 ... done
... model rendered


Writing ortho photo to /var/www/data/bd853eb0-fc89-4fbe-933a-77edcf965e08/odm_orthophoto/odm_orthophoto_render.tif
Set GDAL_CACHEMAX to 7495940096
Writing corner coordinates to /var/www/data/bd853eb0-fc89-4fbe-933a-77edcf965e08/odm_orthophoto/odm_orthophoto_corners.txt
Orthophoto generation done.
[INFO]    Adding pseudo georeferencing (raster should show up at the equator) to /var/www/data/bd853eb0-fc89-4fbe-933a-77edcf965e08/odm_orthophoto/odm_orthophoto_render.tif
[INFO]    Renaming /var/www/data/bd853eb0-fc89-4fbe-933a-77edcf965e08/odm_orthophoto/odm_orthophoto_render.tif --> /var/www/data/bd853eb0-fc89-4fbe-933a-77edcf965e08/odm_orthophoto/odm_orthophoto.tif
[INFO]    Finished odm_orthophoto stage
[INFO]    Running odm_report stage
[INFO]    Exporting shots.geojson
[INFO]    Wrote /var/www/data/bd853eb0-fc89-4fbe-933a-77edcf965e08/odm_report/shots.geojson
[INFO]    Copied /var/www/data/bd853eb0-fc89-4fbe-933a-77edcf965e08/opensfm/camera_mappings.npz --> /var/www/data/bd853eb0-fc89-4fbe-933a-77edcf965e08/odm_report/camera_mappings.npz
[INFO]    running pdal info --dimensions "X,Y,Z" "/var/www/data/bd853eb0-fc89-4fbe-933a-77edcf965e08/odm_georeferencing/odm_georeferenced_model.laz" > "/var/www/data/bd853eb0-fc89-4fbe-933a-77edcf965e08/odm_georeferencing/odm_georeferenced_model.info.json"
[INFO]    running pdal translate -i "/var/www/data/bd853eb0-fc89-4fbe-933a-77edcf965e08/odm_georeferencing/odm_georeferenced_model.laz" -o "/var/www/data/bd853eb0-fc89-4fbe-933a-77edcf965e08/opensfm/stats/overlap.tif" --writer gdal --writers.gdal.resolution=0.006371428571428571 --writers.gdal.data_type=uint8_t --writers.gdal.dimension=UserData --writers.gdal.output_type=max --writers.gdal.radius=0.00901056069740572
[INFO]    running gdaldem color-relief "/var/www/data/bd853eb0-fc89-4fbe-933a-77edcf965e08/opensfm/stats/overlap.tif" "/code/opendm/report/overlap_color_map.txt" "/var/www/data/bd853eb0-fc89-4fbe-933a-77edcf965e08/opensfm/stats/overlap.png" -of PNG -alpha
0...10...20...30...40...50...60...70...80...90...100 - done.
[INFO]    running gdal_translate -of png "/var/www/data/bd853eb0-fc89-4fbe-933a-77edcf965e08/odm_orthophoto/odm_orthophoto.tif" "/var/www/data/bd853eb0-fc89-4fbe-933a-77edcf965e08/opensfm/stats/ortho.png" -b 1 -b 2 -b 3 -b 4 -outsize 1400 0 -co WORLDFILE=YES --config GDAL_CACHEMAX 45.6%
Input file size is 144, 179
0...10...20...30...40...50...60...70...80...90...100 - done.
[INFO]    Exporting report to /var/www/data/bd853eb0-fc89-4fbe-933a-77edcf965e08/odm_report/report.pdf
2026-01-07 05:48:47,459 DEBUG: ICC profile found for image /tmp/tmpmos_r1nv/overlap_diagram_legend.png - It will be inserted in the PDF document
2026-01-07 05:48:48,103 DEBUG: Final size summary of the biggest document sections:
2026-01-07 05:48:48,103 DEBUG: - pages: 3.7KiB
2026-01-07 05:48:48,103 DEBUG: - fonts: 201.0B
2026-01-07 05:48:48,103 DEBUG: - images: 1.8MiB
2026-01-07 05:48:48,103 DEBUG: - iccp: 475.0B
[INFO]    Finished odm_report stage
[INFO]    Running odm_postprocess stage
[INFO]    Post Processing
[INFO]    Finished odm_postprocess stage
[INFO]    No more stages to run
[INFO]    MMMMMMMMMMMNNNMMMMMMMMMMMMMMMMMMMMMMMMMMMMMMMMMMMMNNNMMMMMMMMMMM
[INFO]    MMMMMMdo:..---../sNMMMMMMMMMMMMMMMMMMMMMMMMMMNs/..---..:odMMMMMM
[INFO]    MMMMy-.odNMMMMMNy/`/mMMMMMMMMMMMMMMMMMMMMMMm/`/hNMMMMMNdo.-yMMMM
[INFO]    MMN/`sMMMMMMMMMNNMm/`yMMMMMMMMMMMMMMMMMMMMy`/mMNNMMMMMMMMNs`/MMM
[INFO]    MM/ hMMMMMMMMNs.+MMM/ dMMMMMMMMMMMMMMMMMMh +MMM+.sNMMMMMMMMh +MM
[INFO]    MN /MMMMMMNo/./mMMMMN :MMMMMMMMMMMMMMMMMM: NMMMMm/./oNMMMMMM: NM
[INFO]    Mm +MMMMMN+ `/MMMMMMM`-MMMMMMMMMMMMMMMMMM-`MMMMMMM:` oNMMMMM+ mM
[INFO]    MM..NMMNs./mNMMMMMMMy sMMMMMMMMMMMMMMMMMMo hMMMMMMMNm/.sNMMN`-MM
[INFO]    MMd`:mMNomMMMMMMMMMy`:MMMMMMMNmmmmNMMMMMMN:`hMMMMMMMMMdoNMm-`dMM
[INFO]    MMMm:.omMMMMMMMMNh/  sdmmho/.`..`-``-/sddh+  /hNMMMMMMMMdo.:mMMM
[INFO]    MMMMMd+--/osss+:-:/`  ```:- .ym+ hmo``:-`   `+:-:ossso/-:+dMMMMM
[INFO]    MMMMMMMNmhysosydmNMo   /ds`/NMM+ hMMd..dh.  sMNmdysosyhmNMMMMMMM
[INFO]    MMMMMMMMMMMMMMMMMMMs .:-:``hmmN+ yNmds -:.:`-NMMMMMMMMMMMMMMMMMM
[INFO]    MMMMMMMMMMMMMMMMMMN.-mNm- //:::. -:://: +mMd`-NMMMMMMMMMMMMMMMMM
[INFO]    MMMMMMMMMMMMMMMMMM+ dMMN -MMNNN+ yNNNMN :MMMs sMMMMMMMMMMMMMMMMM
[INFO]    MMMMMMMMMMMMMMMMMM`.mmmy /mmmmm/ smmmmm``mmmh :MMMMMMMMMMMMMMMMM
[INFO]    MMMMMMMMMMMMMMMMMM``:::- ./////. -:::::` :::: -MMMMMMMMMMMMMMMMM
[INFO]    MMMMMMMMMMMMMMMMMM:`mNNd /NNNNN+ hNNNNN .NNNy +MMMMMMMMMMMMMMMMM
[INFO]    MMMMMMMMMMMMMMMMMMd`/MMM.`ys+//. -/+oso +MMN.`mMMMMMMMMMMMMMMMMM
[INFO]    MMMMMMMMMMMMMMMMMMMy /o:- `oyhd/ shys+ `-:s-`hMMMMMMMMMMMMMMMMMM
[INFO]    MMMMMMMMNmdhhhdmNMMM`  +d+ sMMM+ hMMN:`hh-  sMMNmdhhhdmNMMMMMMMM
[INFO]    MMMMMms:::/++//::+ho    .+- /dM+ hNh- +/`   -h+:://++/::/smMMMMM
[INFO]    MMMN+./hmMMMMMMNds-  ./oso:.``:. :-``.:os+-  -sdNMMMMMMmy:.oNMMM
[INFO]    MMm-.hMNhNMMMMMMMMNo`/MMMMMNdhyyyyhhdNMMMM+`oNMMMMMMMMNhNMh.-mMM
[INFO]    MM:`mMMN/-sNNMMMMMMMo yMMMMMMMMMMMMMMMMMMy sMMMMMMMNNs-/NMMm`:MM
[INFO]    Mm /MMMMMd/.-oMMMMMMN :MMMMMMMMMMMMMMMMMM-`MMMMMMMo-./dMMMMM/ NM
[INFO]    Mm /MMMMMMm:-`sNMMMMN :MMMMMMMMMMMMMMMMMM-`MMMMMNs`-/NMMMMMM/ NM
[INFO]    MM:`mMMMMMMMMd/-sMMMo yMMMMMMMMMMMMMMMMMMy sMMMs-/dMMMMMMMMd`:MM
[INFO]    MMm-.hMMMMMMMMMdhMNo`+MMMMMMMMMMMMMMMMMMMM+`oNMhdMMMMMMMMMh.-mMM
[INFO]    MMMNo./hmNMMMMMNms--yMMMMMMMMMMMMMMMMMMMMMMy--smNMMMMMNmy/.oNMMM
[INFO]    MMMMMms:-:/+++/:-+hMMMMMMMMMMMMMMMMMMMMMMMMMNh+-:/+++/:-:smMMMMM
[INFO]    MMMMMMMMNdhhyhdmMMMMMMMMMMMMMMMMMMMMMMMMMMMMMMMMmdhyhhmNMMMMMMMM
[INFO]    MMMMMMMMMMMMMMMNNNNNMMMMMMNNNNNNMMMMMMMMNNMMMMMMMNNMMMMMMMMMMMMM
[INFO]    MMMMMMMMMMMMMh/-...-+dMMMm......:+hMMMMs../MMMMMo..sMMMMMMMMMMMM
[INFO]    MMMMMMMMMMMM/  /yhy-  sMMm  -hhy/  :NMM+   oMMMy   /MMMMMMMMMMMM
[INFO]    MMMMMMMMMMMy  /MMMMN`  NMm  /MMMMo  +MM: .` yMd``` :MMMMMMMMMMMM
[INFO]    MMMMMMMMMMM+  sMMMMM:  hMm  /MMMMd  -MM- /s `h.`d- -MMMMMMMMMMMM
[INFO]    MMMMMMMMMMMs  +MMMMM.  mMm  /MMMMy  /MM. +M/   yM: `MMMMMMMMMMMM
[INFO]    MMMMMMMMMMMN-  smNm/  +MMm  :NNdo` .mMM` oMM+/yMM/  MMMMMMMMMMMM
[INFO]    MMMMMMMMMMMMNo-    `:yMMMm      `:sNMMM` sMMMMMMM+  NMMMMMMMMMMM
[INFO]    MMMMMMMMMMMMMMMNmmNMMMMMMMNmmmmNMMMMMMMNNMMMMMMMMMNNMMMMMMMMMMMM
[INFO]    ODM app finished - Wed Jan 07 05:48:48  2026
100 - done.
Postprocessing: /var/www/data/bd853eb0-fc89-4fbe-933a-77edcf965e08

Found point cloud: odm_georeferencing/odm_georeferenced_model.laz

Entwine point cloud is already built.

Entwine point cloud is already built.
Postprocessing: done ()!
